,comment,sent,off
7267,🤣🤣 sakath guru,Positive,Not_offensive
5061,Vijayprakash Golden Voice...,Positive,Not_offensive
1,#1 ON TRENDING,Positive,Not_offensive
3153,Nama Kannada channel Dinesh ss qthjjko,Positive,Not_offensive
1838,Egina youth's ge spoorthy sir nivu Devaru nimge ayyasu aarogya channagi kodli,Positive,Not_offensive
5801,ಅಲ್ಲಾಉದ್ದೀನ್ ಯಾರು ಸರ್,Positive,Not_offensive
3652,Prajwal devaraj looks sooooo handsome in ANANTHU VS NUSRUTH kannada movie,Positive,Not_offensive
3703,Raaja prathyaksha devatha ....,Positive,Not_offensive
563,@Rajashekar Khandare Houdu sir ashwathamanige chiranjivi vara ide adakke avanige sri krishna aatara shrapa kottiddu ashwatama shivana innondu rudra avtara,Positive,Not_offensive
5875,ಇದು ಚರಿತ್ರೆ ಶೃಷ್ಟಿಸೋ ಅವತಾರ nರಕ್ಷಿತ್ ಶೆಟ್ಟಿ Namma Emotion ಅನ್ನೋರು ಲೈಕ್ ಮಾಡಿ,Positive,Not_offensive
5482,kannadavu support madalla jatre song matra views agodu.tiktok ellla busy agavre . telugu alli 1 day 10 millon agutte namalli agalla,Negative,Not_offensive
2559,Illi neevu aa hesaranna heLohagoo ilvalla.48 beka bitti thinno baayiglu ottigr barathve.modalu lancha hogbeku,Negative,Offensive_Targeted_Insult_Individual
5384,basavaraj tambak artha madbeku movie na movie thara nodbeku,Positive,Not_offensive
5325,Yes sang ok sang,Negative,Not_offensive
1133,Anna super agi edit madidiya,Positive,Not_offensive
2153,Guru sure news nanu tik tok dawn lod madeda yavaga nama nDudu tindu nama dashda mala uddha madaka bandro avaga deleted,Positive,Not_offensive
5041,Views tumba kadime ide.,Negative,Offensive_Untargetede
2547,Idu kgf beat madutte annoru like here,Positive,Not_offensive
6149,ಕನ್ನಡ ನಾಡಿನ ಹೆಮ್ಮೆಯ ಚಿತ್ರ,Positive,Not_offensive
5924,ಇದು ರಕ್ಷಿತ್ ಶೆಟ್ಟಿ ಚರಿತ್ರೆ ಸೃಷ್ಟಿಸೋ ಅವತಾರ nನಿಮ್ಮಂತಹ ಸೃಜನಶೀಲ ಮತ್ತು ಚಾಣಕ್ಯ movie maker ನಮ್ಮ ಕರ್ನಾಟಕದಲ್ಲಿ ಇರುವುದು ನಮಗೆ ಹೆಮ್ಮೆ,Positive,Not_offensive
3785,Raxit shetty uvarige ondu namaskar ide tara uvaru kannad film madali uvar comedy tumba chennagide.,Positive,Not_offensive
6537,ನಮ್ಮ ಉರೀನ ಟ್ಯಾಲಂಟ,Positive,Not_offensive
4510,Super sir yentha mathu nivu sir nijavada tik tok bagge thilekondirodu,Positive,Not_offensive
3981,Sir hagadre namma desha kooda communist rastra agbeka?,Mixed,Not_offensive
6806,ಮನೆಯಿಂದಲೇ ಸಂಪಾದಿಸಬೇಕೇ? With income proof. WhatsApp 6362806874,unknown,Offensive_Untargetede
5198,Yaka anna difference madtira AAPA AAPANE MAGA MAGANE BOTH ARE GOOD NLY,Negative,Offensive_Targeted_Insult_Individual
5402,corrcet aghi baydidira doddhu hero thara adthare thu....,Positive,Offensive_Targeted_Insult_Group
770,@d boss mania Nanag gottu bido childnnPailwaan flop,Negative,Not_offensive
1599,Curectagi mathadodanna kali..,Negative,Offensive_Targeted_Insult_Group
1673,Devaru olledu madtane sir..nimge chenag iri,Positive,Not_offensive
3590,Pandavaru mamsa tinthidra,unknown,Not_offensive
1807,Edralli nivu enu overagi mathadilla bro,Negative,Not_offensive
3786,Re e video post agiddu yavaga apps ban agirodu yavaga adu moldu nodir sumne yeneno mathadbedi,Negative,Offensive_Targeted_Insult_Group
3863,Salute for music,Positive,Not_offensive
953,ASN release in nKannada-Dec 27nTelugu-Jan 1stnTamil& Malayalam-Jan 3rdnHindi-jan16thnnAstaralli Ella mobile nalli nodi Mugsirtaare aaga release Maadi Aden record Create maadtaro?n300 koti Beku anta Tweet maadidre saaladu ondu cinemana Janagalige Yav reethi Talupisodu anta gottirbeku.... Kurukshetra ide reethi Promotion ilde haalagi hoytu...Innoo idunnoo hange maadtidaare,Negative,Offensive_Untargetede
5391,bro nim video super china da appp use madbardu annod sari k nivu e china game pubg adthiralla bro nivu next video na e pubg game enda madbedi nan nimna geli madthaedini ankobedi,Positive,Not_offensive
5252,Yava game name,Mixed,Not_offensive
5670,tippa yappa supper,Positive,Not_offensive
1960,Film benki ide gurunKannada film industry li ide Tara saviraru cinema barli,Positive,Not_offensive
6399,ತುಂಬಾ ಚನ್ನಾಗಿ ಮೂಡಿ ಬಂದಿದೆ ಮತ್ತು ನಿರೀಕ್ಷೆ ಹುಟ್ಟಿಸುವಂತಿದೆ. ಸಿನಿಮಾ ಬಿಡುಗಡೆಗೆ ಕಾಯುತ್ತೇವೆ. ಒಳ್ಳೆಯದಾಗಲಿ,Positive,Not_offensive
3391,Nimge olledagli sir god bless you Sir,Positive,Not_offensive
3798,Really nyc sakath chenagi madidira nange esta aythu. Super riii adrallu tiktok dattu putra nna sakath roast madi heltini...,Positive,Not_offensive
1201,Avanige gaya vasi agbeku andre..avnu krishna na bhakti madi..vasi madbeku eela Kaliyuga nasa agbeku,Mixed,Offensive_Targeted_Insult_Other
2257,Hats off to News channel .nಅದ್ಭುತವಾದ ವ್ಯಕ್ತಿಯನ್ನು ಪರಿಚಯಿಸಿದ್ದಕ್ಕೆ.,Positive,Not_offensive
5421,first time keldaga ista agalla amel kelta kelta kelbeku ansatte.. nimgu haage annista,Positive,Not_offensive
5680,tumbane chennagide haadu.,Positive,Not_offensive
5399,chindi step chindi bgm superrrr,Positive,Not_offensive
2011,Full movie up load me sir,Positive,Not_offensive
3537,One week salala .reach abeku ivag ela fast ide .nyc movie nodbeku etara agbhardu .node nodthare jana nodo tym ivag irbeku .etara agbhardu,Positive,Offensive_Targeted_Insult_Other
987,Adi dia super acting🥰,Positive,Not_offensive
4487,Super ri bro,Positive,Not_offensive
4371,Super gelaya a nan sulege magalu chinadorage hutidale,Negative,Offensive_Targeted_Insult_Group
2754,Kannadadalli ee Tara cinematography iro movies innu barli,Positive,Not_offensive
3603,Pistol look like flare gun...nnJai pubg..,Mixed,Not_offensive
1541,China copy maadi naawu maadbekilla.. jana alli khushyaagilla.. naadre niw helidralli tumba kelsa aagbeku.. bhaaratadalli adella maadodu janakku bekaagalla,Positive,Not_offensive
6578,ನಾನು ಕನ್ನಡದ ಗುಲಾಮ.. ನನಗೆ ಈ ಪದ ಯಾಕೆ ಅಷ್ಟು ಇಷ್ಟ ಆಯ್ತು ಅಂದ್ರೆ ಸಾಹಿತ್ಯ ಅಚ್ಚ ಕನ್ನಡದಲ್ಲಿ ಮೂಡಿ ಬಂದಿದೆ,Positive,Not_offensive
6696,ನೈಸ್ ಸಾಂಗ್ D ಬಾಸ್,Positive,Not_offensive
1637,DOP and dance styles are lit,Positive,Not_offensive
2852,Like madi link share madi,unknown,Not_offensive
299,@Kiccha Vitthal ಏನ್ಲ ಬಳೆಗಾರ ಲುಚ್ಛನ್ ಫ್ಯಾನ್ಸ್,Negative,Offensive_Targeted_Insult_Individual
2048,Genuine information nimdhu,Positive,Not_offensive
806,@naveen v  looo bolimagane thikaana muchkondu idre sari nim ammun thullu nin yaavano mathadsidhu nim avan vishya bandna neenu naan bagge matra madthadbeku,Negative,Offensive_Targeted_Insult_Individual
3080,Munde nodona sadhyakke a plan illa,Negative,Not_offensive
1914,Eppa all fake,Negative,Offensive_Untargetede
1061,Amar prasaad sir nam deshadalli chaina kinta  talehidukaru jassti edare gotta nam desha en kammi ella eslamikarana maadodaralli chaina kinta kammi ella nam deshadalli jana nammanna aa devastanakke sersilla ee devastanakke serlilla annoru chaina kinta kammi ella 100 ralli 35 % marks tagondru avrige meesalatiyalli kelsa tagolloru en chaina kinta kammi ella.nodona  chainadalli estodu savalattu torsi nodona.,Negative,Offensive_Targeted_Insult_Group
7207,ಹಾಡು ಸುಪರ್ ಸಂಗೀತ ಸಂಯೋಜನೆ ಸುಪರ್ ಸುಪರ್,Positive,Not_offensive
2614,Ivrella nijvaglu nam Indian anta ansutte anna yappa istu himse kodtidru tiktok antidaralla yappa nijvaglu ivnella nijvaglu aaisbeku,Negative,Not_offensive
205,@Asif Shaikh hesru adru nettug tilkolo,Negative,Offensive_Targeted_Insult_Individual
269,@Gajendra hv ayyo bewarsi,Negative,Offensive_Targeted_Insult_Individual
6691,ನೀವು ಹೇಳಿದ ಕಥೆ ಚನ್ನಾಗಿಯೇ ಇದೆ ಆದ್ರೆ ಅಶ್ವತ್ತಾಮ ಬದುಕಿರೋದು ಸುಳ್ಳು,Negative,Offensive_Targeted_Insult_Group
4442,Super movie in kannad film industry,Positive,Not_offensive
6531,ನಮಸ್ಕಾರಗಳು ಗುರುಗಳೇ,Positive,Not_offensive
4177,Super  Anna,Positive,Not_offensive
4020,Sir ond compeny yalli kelsa madidra gov employes labor officer bookmadkond laber ge 5000 salry kotre employe mane  est kasta alva. yava gov sarilla sir nav egga comment madkondu saibeku aste,Negative,Offensive_Targeted_Insult_Group
4308,Super bro nim song,Positive,Not_offensive
2985,Masthmaga na duplicate madbitaru Amar sir,Negative,Offensive_Targeted_Insult_Individual
901,@vinay shivamogga **uter,unknown,Offensive_Targeted_Insult_Individual
2705,Kannada adru swalpa parvagilla guru Telugu Tamil movies anthu jaatre dialogue jaatre fighting over acting inda thumbi tuluktha ide.,Negative,Offensive_Targeted_Insult_Group
7000,ಸತ್ಯಕ್ಕೆ ಸಾವಿಲ್ಲ ಸುಳ್ಳಿಗೆ ಸುಖವಿಲ್ಲ  ಇದುಸತ್ಯ,Positive,Not_offensive
3202,Nandini Parthasarathi ascar just miss n,Mixed,Offensive_Targeted_Insult_Individual
5294,Yena editing guru,Mixed,Offensive_Targeted_Insult_Individual
480,@Nandi Parthasarathi ನಿಮ್ಮ ಅವ್ವುನ್ ತುಲ್ಲಗೆ ಹಳಸಿದ್ ಹೋಳಿಗೆ ಹಾಕ,Negative,Offensive_Targeted_Insult_Individual
5196,Yak late guru,unknown,Not_offensive
984,Adhi... Sprb acting. Olle avakashagalu sigli nimge. Idi team gu olled agli,Positive,Not_offensive
6128,ಕಥೆ ಅರ್ದ ಅಗಿದೆ.ಅಶ್ವತ್ತಾಮ ತನ್ಣಗಾಯಗೊಂಡ ದೇಹವನ್ನು ಗುಣಪಡಿಸಿದ್ದು ಕಲ್ಲಡ್ಕ ಪ್ರಭಾಕರ್ ಭಟ್.ನಂತರ ಅಶ್ವತ್ತಸಮ ತನ್ನ ಹೆಸರು ಬದಲಾಯಿಸಿ .ನರೇಂದ್ರ ದಾಮೋದರ ಮೊಲದಿ ಎಂಬ ಹೆಸರಿನಿಂದ ಬಾರತದ ಪ್ರದಾನಿಯಾಗಿ    ಅತನ ಅನುಯಾಯಿಗಳೇ ಮೋದಿ ಭಕ್ತರೆಂಬ ಕೌರವರು ಇವಾಗ ಮುಸ್ಲಿಂ ಎಂಬ ಪಾಂಡವರ ವಿರುದ್ದ ಕುತಂತ್ರ ಯುದ್ದ ಮಾಡುತ್ತದ್ದಾರೆ..,Negative,Offensive_Targeted_Insult_Group
1366,Bindu Gowda idko nan Lowda.🤣,Negative,Offensive_Targeted_Insult_Individual
3338,Nija heludre heege,Negative,Offensive_Targeted_Insult_Individual
5067,Vishwajeet chauhan ok da cool,unknown,Not_offensive
2746,Kannada.....🤦matte remake film.,Negative,Offensive_Untargetede
4279,Super annna neevu,Positive,Not_offensive
5530,nim songs super,Positive,Not_offensive
1780,E nayi nann makkalage thiliyode illa,Negative,Offensive_Untargetede
5114,Wet madbeku allwa🥰,Mixed,Not_offensive
6829,ಮೊದಲು ನಿನ್ನ ಗುಲಾಮು ಜಾಮ್ ಬಿದ್ದಿದ್ದ ನೋಡು,Negative,Offensive_Targeted_Insult_Individual
904,@vinay vinu kanditha bro shigradalli,Positive,Not_offensive
2537,Idu charitre srustisuva avataranME,Positive,Not_offensive
4815,This songs is sounds like ಕೋಟಿಗೊಬ್ಬಾ  ಕೋಟಿಗೊಬ್ಬಾ ... 🤨 ( ಕೋಟಿಗೊಬ್ಬ 2 ),Mixed,Not_offensive
4697,Superbb movie osm evthu movie nodied super,Positive,Not_offensive
5064,Villan is khadak,Positive,Not_offensive
6067,ಎಸ್ ಸೂಪರ್ ಸಾಂಗ್,Positive,Not_offensive
6250,ಗುರು ಎಲ್ಲಿದ್ದೆ ಗುರು ಇಷ್ಟು ದಿನ🤣,Positive,Not_offensive
4980,Unique aagide trailer.. namma kannada film antha proud feel li bere languages frnds gella thorista idini trailer na,Positive,Not_offensive
6826,ಮೇಜರ್ ಜನರಲ್ ಅಬಿನಂಧನ್  ವರ್ಧಮಾನ್ ಡಿ ಬಾಸ್ ದರ್ಶನ್ ಅಭಿಮಾನಿಗಳಿಂದ ನಿಮ್ಮ ಚಿತ್ರಕ್ಕೆ ಶುಭವಾಗಲಿ...,Positive,Not_offensive
1512,By mistakly nimma ondu video nodi subscribe agbitte  keep it up bro,Mixed,Not_offensive
5451,hudugru hidgiraagodu talent,Positive,Offensive_Targeted_Insult_Group
1759,Dum andhre star hero galu tageyuva build up movie taraha irbekaagitta,Negative,Offensive_Targeted_Insult_Group
5254,Yavado yavado hakithira realu videos madi haki elwa edana neja agedre proove madi News Ali haki,Negative,Offensive_Targeted_Insult_Group
2225,Hands up yav pada pa,unknown,Not_offensive
5395,brother ಆ ನನ್ ಮಕ್ಳಿಗೆ ಅರ್ಥ ಆಗೋಥರ..... ಹೇಳಿದೀರಾ.... ಅವ್ರಿಗೆ ಹೀಗೆ ಹೇಳಿದ್ರೇನೇ ಅರ್ಥ ಆಗೋದು....,Negative,Not_offensive
5087,Waiting for the film.....ನೋಡಲು ಕಾತುರನಾಗಿದ್ದೇನೆ,Positive,Not_offensive
103,2k dislikes rashmika maandanna fanss,Negative,Offensive_Targeted_Insult_Individual
4408,Super heart touching movies. Wonderful beautiful film. ಈ ಚಲನಚಿತ್ರವನ್ನು ಹೇಗೆ ವರ್ಣಿಸಬೇಕು ಅಂತ ಗೊತ್ತಾಗ್ತಿಲ್ಲ. ಪದಗಳೇ ಸಿಗುತ್ತಿಲ್ಲ. ನಾವು ಅಂತು n Waiting dia  chapter 2.,Positive,Not_offensive
6791,ಭಹಾಳ್ ಚನ್ನಾಗಿ ಇದೆ,Positive,Not_offensive
3257,Neen en medhavi Eno guldu,Negative,Offensive_Targeted_Insult_Individual
6130,ಕಥೆ ಸರಿಯಾಗಿ ತಿಳಿದುಕೊಳ್ಳಿ..... please don't worng guide..... ಅಶ್ವತ್ತಾಮ ಶಿವನ ಅವತಾರ.... ಇಂದ್ರನಲ್ಲಿ ಸುಳ್ಳು ಹೇಳಿದಕ್ಕಾಗಿ ಭೂಮಿಯಲ್ಲಿ ದೀರ್ಘ ಕಾಲಿ ಯಾಗಿ ಅವತಾರಿಡಿದರು ಅಷ್ಟೇ...... ಕೃಷ್ಣ ಅವರಿಗೆ ಶಪಿಸಲಿಲ್ಲ,Mixed,Offensive_Targeted_Insult_Group
1137,Anna super song...,Positive,Not_offensive
1690,Different aagide song... n,Mixed,Not_offensive
5117,What a making 🤭🤭🤭 suppppperrrrr rakshith Shetty bro...ur a genius...Nam kannada indestry and kannadigru yargu yavdhrallu kadme Ella.. hatsup sir,Positive,Not_offensive
6392,ತುಂಬಾ ಒಳ್ಳೆ ಚಿತ್ರ,Positive,Not_offensive
3835,SORRY FOR KANNAD INDUSTRY...I      BUT ಇಂತಹ ಫಿಲ್ಮ್ ಬಗ್ಗೆ ಯಾವುದೆ ಮಾಹಿತಿ ಇರಲಿಲ್ಲ ...ಈಗ ಮತ್ತೆ ಎಲ್ಲಾ ಟಾಕಿಸಲ್ಲಿ ಹಾಕಿಸಿ...ಸರ್...ಆದರೆ ಈಗ ಮತ್ತೆ  ಬಂದರೆ..ಟಾಕಿಸಲ್ಲಿ ಫುಲ್ ಆಗಿರುತ್ತದೆ ...,Negative,Not_offensive
4553,Super song buddy,Positive,Not_offensive
6682,ನೀನು ಸೂಪರ್ ಗುರು  ಆದರೆ ನಮ್ಮ ಈಗಿನ ಯುವ ಜನತೆ ಯಾಕೆ ಎ ತರ ಸಮಯ ಅಲ್ಮಾಡ್ತಾರೋ ಗೊತ್ತಿಲ,Negative,Offensive_Targeted_Insult_Group
6479,ದೃಷ್ಟಿ ನನ್ನೋಬ್ಬನ ಮೇಲಿಡಿ ತಪ್ಪದು ನಿಜ ಮನರಂಜನೆ film nodo munchene ee song ista adavaru like madi,Positive,Not_offensive
5748,ಅಣ್ಣಾ ಈ ವಿಡಿಯೋ ಮಾಡಿದಕ್ಕೆ ನಿನ್ಗೊಂದು ದೊಡ್ಡ ನಮಸ್ಕಾರ ಚೆನ್ನಾಗಿ ಹೇಳಿದೆ,Positive,Not_offensive
1578,Continue 8 sali kelide song bejare aglilla chindi song and music,Positive,Not_offensive
564,@Rajashekar Khandare ಕ್ರಷ್ಣನೇ ಶಾಪ ಕೊಡುವುದು ...ಮಯ್ಯಲ್ಲಿ ಕೀವು ತುಂಬಿ ಚಿರಂಜೀವಿ ಆಗಿ ತಿರುಗಾಡುತ್ತಾ ಇರು ಅಂತ....,Positive,Not_offensive
4905,Togari tippa story super,Positive,Not_offensive
6512,ನನಗೆ ಹಾಲು ಕುಡಿದಷ್ಟು ಸಂತೋಷವಾಯಿತು ಜೈ ಮೋದಿಜಿ🤣🤣🤣,Positive,Not_offensive
4625,Super video anna,Positive,Not_offensive
1880,En song madidiri boss ninne inda 20 sari kelidini innu kelbeku kelbeku antha anstide,Positive,Not_offensive
2281,Heloke padagale siktilla anno padakke artha sikkkantagide,Positive,Not_offensive
3201,Nanagu hage ansate,Positive,Not_offensive
1370,Bindu gowda ge super agi ugididdeera,Negative,Offensive_Targeted_Insult_Individual
3349,Nijavada hero andre evare,Positive,Not_offensive
1779,E movie pakka charitre shrustisuttade,unknown,Not_offensive
3710,Rakshi shetty fans yar edera like made,Positive,Not_offensive
128,4 ಜನ ಇರುವ ಈ ಸಿನಿಮಾ ..4 ಕೋಟಿ ಕನ್ನಡ ಸಿನಿಮಾ ಪ್ರೇಕ್ಷಕರಿಗೆ ತಲುಪಲಿ ...ದೀಯಾ ಸಿನಿಮಾ ಅದ್ಬುತವಾಗಿದೆ ...,Positive,Not_offensive
6212,ಕೆಲಸ ಬೇಕಾnCall to 8546903696,unknown,Not_offensive
4873,Tika hogibeku avlige,Negative,Offensive_Targeted_Insult_Individual
6615,ನಿಜ ಹೇಳಿದ್ರು ಆದರೆ ಇದರಲ್ಲಿ ಸಬ್ಸ್ಕ್ರೈಬ್ ಇರೋದು ಮೂರು ಲಕ್ಷ  ಆನಂದಾಡಿಯೋದರಲ್ಲಿ ರಿಲೀಸ್ ಮಾಡಿದರೆ ಒಡೆಯ ಸಾಂಗ್ ಮೀರಿಸಿತಿತ್ತು,Negative,Not_offensive
6446,ತೋಗರಿ ತಿಪ್ಪ ಸೂಪರ್,Positive,Not_offensive
5904,ಇದು ಚರಿತ್ರೆ ಸೃಷ್ಟಿಸೋ ಸಾಂಗ್!!!nಮಧ್ಯ  ಸೇವನೆ  ಅಭ್ಯಾಸದಿಂದ ಬೇಕಾದ್ರೆ ಮುಕ್ತಿ ಪಡೆಯಬಹುದು ಆದ್ರೆ ಈ ಸಾಂಗ್ ಇಂದ ಅಲ್ಲ  ನಿಜಾ ಅನ್ನೋರು Hands Up ಮಾಡಿ,Positive,Not_offensive
604,@Scorpion Studios  nನಮಸ್ಕಾರ 🤣🤣,Mixed,Not_offensive
6552,ನಮ್ಮ ದೇಶದಲ್ಲಿ ಎಣ್ಣೆ ಗೆ. ಇಂಪಾರ್ಟೆಂಟ್ ಕೊಡ್ತಾರೆ..,Negative,Offensive_Targeted_Insult_Other
2714,Kannada film  industry avaru sir solpa nodi rii yen madta ididra inta ashvath sir avara maga ondu sanni veshe dalli kalsa Kodi,Mixed,Not_offensive
6766,ಬಿಂದು ಗೌಡ ಟಿಕ್ ಟಾಕ್  ಬ್ಯಾನ್ ಆಯಿತು ಮನೇಲಿ ಪಾತ್ರೆ ತೊಳಿ,Negative,Offensive_Targeted_Insult_Individual
5751,ಅಣ್ಣಾ ಬಾಂಡ್ ಚೆನ್ನಾಗಿ ಬೆಂಡ ಎತ್ತಿದ,Positive,Offensive_Untargetede
5296,Yenandru chamayya mestra magaa,Positive,Not_offensive
2145,Guru sakatha helidiya guru,Positive,Not_offensive
5755,ಅತ್ಯುತ್ತಮ ಪ್ರಯತ್ನ ಶುಭವಾಗಲಿ,Positive,Not_offensive
1169,Ashwatama ge Kannada barutte yenri,Mixed,Not_offensive
705,@VARAPRASAD K K nin Amman thika nayi keyya dagaar darshan elladru neenu huttakintha munche nin appan munche koting kottidda ansutte soole magne nin amman dengaa,Negative,Offensive_Targeted_Insult_Individual
220,@Chaitanya P ? Haagandre yenu? Nam hero yellakade gelbekalwa?..,Mixed,Not_offensive
1859,En guru nim video ge fan agode aitu nimge namma kade inda subscribe,Positive,Not_offensive
6074,ಏನು ತಪ್ಪಿಲ್ಲ ಸರಿಯಾಗಿ ಹೇಳಿದ್ದಿರಾ,Positive,Not_offensive
3252,Navu. Rent tagondu,unknown,Not_offensive
3482,OMG nange gotte irlilla prajwal hatra istond ide anta,Positive,Offensive_Targeted_Insult_Individual
1570,Climax Swalpa Change madbekittu...,Negative,Offensive_Targeted_Insult_Group
5816,ಅವನೇ ಶ್ರೀಮಾನ್ ನಾರಾಯಣ .. ಕುಡುಕನ ವರ್ಷನ್..nnಹೇ.. ನಿಮ್ಮನ್ನೆಲ್ಲ ಯಾರೋ ಒಳಾಗ್ ಬಿಟ್ಟಿದ್ದೂ..nnನನ್ ಮುಖ ನೋಡಿ ಕೇಳ್ತಿದೀಯಾnnಬೋರ್ಡು ಕಾಣುಸ್ತಾ ಇಲ್ವಾ,Positive,Offensive_Targeted_Insult_Other
4150,Sudeep du olle movies innu idave.nnPhantom,Positive,Not_offensive
2534,Idu charitre srustiso  avathara...,Positive,Not_offensive
4189,Super  maga,Negative,Not_offensive
765,@chetan kumarab nan yavagloo compare maddhe...,Mixed,Offensive_Targeted_Insult_Individual
5293,Yen thapu illa Inna chanag ugibeku,Negative,Not_offensive
2867,Lo troll madtadyalla nin us mado mobile ysvdo,unknown,Offensive_Targeted_Insult_Individual
1317,Best film ide sirr love u alla ಯಾಕೆ ಇ film ಇಷ್ಟ ಅಂದ್ರೆ ಇದರಲ್ಲಿ ಬರುವ ಪಾತ್ರ ನಮ್ಮ್ಗ ಎನೂ link ಇದೇ ಅನ್ನೋ ಥರ ಇದೆ supper sir,Positive,Offensive_Targeted_Insult_Group
6230,ಕ್ಷಮಿಸಿ ದಿಯಾ ಟೀಮ್ .....,Mixed,Not_offensive
3578,Pakka hit agutthe guru movie,Positive,Not_offensive
740,@Vishal Shetty oh karch maadko hogu.... yello yaardo mundaav ikki sampadane maadirtya....,Negative,Offensive_Targeted_Insult_Individual
7160,ಸೂಪರ್ ಸೂಪರ್ ಸೂಪರ್ ಸೂಪರ್ ಸೂಪರ್ ಸಾಂಗ್,Positive,Not_offensive
2583,Inta kate matte matte krlbeku ansatte super,Positive,Not_offensive
6241,ಗುಡ್ ಲಕ್ ಶ್ರೀಮನ್ನಾರಾಯಣ ರಕ್ಷಿತ್ ಶೆಟ್ರೇ.. ಮಸ್ತ್ ಡಿಫ್ರೆಂಟ್ ಆದುಂಡು ಸಾಂಗ್,Positive,Not_offensive
6641,ನಿನ್ನೆ ಅಷ್ಟೆ movie ನೋಡಿದೆ.movie,Mixed,Not_offensive
6177,ಕನ್ನಡದವರು ಈ ತರ ಸಿನಿಮಾ ಮಾಡ್ತಾರೆ ಅಂತ ದಿಯಾ ಸಿನಿಮಾ ತಂಡ ಸಾಬೀತು  ಮಾಡಿದೆ....ಬರೀ ತೆಲಗು ತಮಿಳು ಸಿನಿಮಾ ನೋಡದಲ್ಲ ಕನ್ನಡ ಸಿನಿಮಾ ನೋಡಿ ಮಿಸ್   ಮಾಡಬೇಡಿ,Negative,Offensive_Untargetede
2193,Hands Up antha Rashmika goskara bardang ide,unknown,Not_offensive
3223,Nanu 2 sala nodidini,unknown,Not_offensive
878,@shivaraj shivu ನಾನು ದೊಡ್ಡಬಳ್ಳಾಪುರದ ಅಸಲಿ ಕನ್ನಡಿಗ,Positive,Not_offensive
7079,ಸುಪರ್ ಇಟ್ ಸಾಂಗ್ ಡಿ ಬಾಸ್ ಆಗಲೇ ಬೇಕಿತ್ತು ಸೂಪರ್ ರಕ್ಷಿತ್ ಶೆಟ್ಟಿ,Positive,Not_offensive
1356,Bidu guru vorkolru edri moduke hogudu nLike China nodi navu bega fast hagbekantilva hage,Mixed,Not_offensive
6445,ತೋಗರಿ ತಿಪ್ಪ  ನಕ್ಕು ನಗಿಸುವ ಕಥನ.,Positive,Not_offensive
5390,bro lovely bro..oogiri mokakke,Negative,Offensive_Untargetede
2332,Hindi song bittilva?,unknown,Not_offensive
3233,Nanu nodhidhini uttar Pradesh forest,unknown,Not_offensive
6695,ನೈಸ್ ಚಿತ್ರ ಅವನೇ ಶ್ರೀ ಮಾನ್ ನಾರಾಯಣ........ ಸೂಪರ್ ರಕ್ಷಿತ್ ಶೆಟ್ಟಿ.......,Positive,Not_offensive
7108,ಸೂಪರ್ ಆಗಿ ಹೇಳಿದ್ದೆ ಗುರು,Positive,Not_offensive
237,@DACCHU D BOSS ennu release aagila bro.,Positive,Not_offensive
3292,Nice bro Nina vicoe super,Positive,Not_offensive
4048,Sir.. 5paisa.com adara bagge video madi... Open madodhu hege and close madodhu hege antha... Plz sir,Positive,Not_offensive
6741,ಬದುಕಿಗೆ ನೂರು ದಾರಿ..ಆ ಕಾಲದ ತೊಗರತಿಪ್ಪನಿ  ಬುದ್ಧಿಮತ್ತೆಗೆ ನೂರು ಸಲಾಂ.. ಹಿರೇಮಠ ಹೋತಪೇಟ,Positive,Not_offensive
1520,Chalu ati nataka,unknown,Not_offensive
5934,ಇದೇ ಥರ ಕನ್ನಡ  ಚಲನಚಿತ್ರಗಳು ಚರಿತ್ರೆ ಸೃಷ್ಟಿಸಲಿ ಇದೆ ಚರಿತ್ರೆ ಸೃಷ್ಟಿಸುವ ಅವತಾರ  ಅವನೇ ಶ್ರೀಮನ್ ನಾರಾಯಣ,Positive,Not_offensive
3336,Nija heliddiya guru.nEvr mane yaradru bordernalli sattidre gottagodu.,Negative,Offensive_Targeted_Insult_Group
6448,ಥಿಯಾ ಸುಂದರವಾದ ರೋಮ್ಯಾಂಟಿಕ್ ಮಹಾಕಾವ್ಯವಾಗಿದ್ದು,Positive,Not_offensive
425,@Nandi Parthasarathi ninamman shata kilaka helde baa antha gandu,Negative,Offensive_Targeted_Insult_Individual
1293,Bazaar annodu kannada padana guru?,unknown,Not_offensive
4133,Startup start maadalu capacity growth maadalu tips kodi . Ondu separate video maadi .pls,Positive,Not_offensive
3897,Sasthanga namaskaar guru nale,Positive,Not_offensive
6466,ದಿಯಾ ಕನ್ನಡದಲ್ಲೆ sooper film...ಕಾಸು ಕೊಡದೆ ಬಿಟ್ಟಿಯಾಗಿ ನೋಡಿದೆ ಅನ್ನೋ ಬೇಜಾರಿದೆ..ಸಿನಿಮಾ ಗೆಲ್ಲಲಿ..,Negative,Not_offensive
6769,ಬಿಟ್ಟ ಹೋಗಿರೋ ರಶ್ಮಿಕಾ ಗೆ ಹೇಗ್ ಆಗ್ಬೇಕು ಗೊತ್ತಾ ಯಾಕಾದ್ರೂ ಬಿಟ್ಟ ಹೋದೆ ರಕ್ಷಿತ ಅವರನ್ನ ಅಂತ ಫೀಲ್ ಆಗ್ಬೇಕು ಆ ತರಾ success ನಿಮ್ಮದಾಗಲಿ ಶ್ರೀನಮ್  ನಾರಾಯಣ ಸಿನಿಮಾ,Negative,Offensive_Targeted_Insult_Individual
5777,ಅಧ್ಬುತ ಶೆಟ್ರೆ ‌...ಮಾಯಲೋಕದ ಕಿನ್ನರನೋ,Positive,Not_offensive
7104,ಸೂಪರ್ ಅದ್ಭುತವಾದ ಸಿನೆಮಾ,Positive,Not_offensive
5620,super film kavanadalli kathe,Positive,Not_offensive
1309,Bere Level #ASN #'Hands Up',Positive,Not_offensive
3372,Nim maathugalu thumba esta aaythu sir,Positive,Not_offensive
6167,ಕನ್ನಡದಲ್ಲಿ  ಬರಹವನ್ನು  ಬರೆದ  ನಿಮಗೆ  ನನ್ನ  ಅಭಿನಂದನೆಗಳು ಸಿನಿಮಾ  ಚೆನ್ನಾಗಿದೆ   ನನ್ನ  ಹೃದಯಕ್ಕೆ  ಮನಸ್ಸಿಗೇ ಮುಟ್ಟಿದ ಸಿನಿಮಾ ಇದು... ಒಳ್ಳೆಯದಾಗಲಿ,Positive,Not_offensive
6900,ರಕ್ಷಿತ್ ಶೆಟ್ಟಿ ಪಿಲ್ಮ ಯಾರಿಗೆ ಇಷ್ಟಯಿಂದೆ  ಅವರು ಲೈಕ್ ಮಾಡಿ ಪ್ಲೀಸ್,Positive,Not_offensive
2361,Hit bidu guru,Positive,Not_offensive
6949,ವಾವ್ ಸೂಪರ್ ಹಿಟ್,Positive,Not_offensive
5711,yest olle kalsa nan yavag e kelsa madtaro anta kaytayde thamk u brother full happy,Positive,Not_offensive
