,comment,sent,off
6490,ಧ್ರುವ ಬಾಸ್ ಅಭಿಮಾನಿಗಳು ಲೈಕ್ ಮಾಡಿ,unknown,Not_offensive
1524,Charitre shrushtiso avatara,Positive,Not_offensive
5988,ಈ ಸಾಂಗ್ ಚನ್ನಾಗಿದೇ,Positive,Not_offensive
1858,En guru edu song super,Positive,Not_offensive
7167,ಸೂಪರ್ ಹಿಟ್ ಸಾಂಗ್ಸ್,Positive,Not_offensive
109,3.1k ಉರ್ಕೊಂಡು ಸಾಯ್ರಿ,Negative,Offensive_Targeted_Insult_Other
2736,Kannada nigant allli dagar Andre enu artha gotta?n,Mixed,Offensive_Untargetede
5415,entha song gu dislike madidare ala broo,Negative,Offensive_Targeted_Insult_Group
2511,Idonde voledagiradu 2020 li,Mixed,Not_offensive
1007,Ajaneesh lokanatha sir nodiyo kaliyo arujuna janya,Positive,Offensive_Untargetede
4867,Tik tok shata,Negative,Offensive_Targeted_Insult_Group
1401,Boss ದಯಮಾಡಿ 1 year  ಗೆ ಒಂದು ಸಿನಿಮಾ ಆದರೂ ಮಾಡಿ ಮತ್ತೆ ನಿಮ್ಮಲ್ಲಿ ಇರುವ ನಿರ್ದೇಶಕನನ್ನ ಮಾತ್ರ ಸಾಯಿಸಬೇಡಿ nನಿಮ್ಮಲ್ಲಿ ಏನೋ ಒಂದು ವಿಶಿಷ್ಟ ಶಕ್ತಿಯಿದೆ ರಕ್ಷಿತ್ ಶೆಟ್ಟಿ ಅವರೇ...nಪುಟ್ಟಣ್ಣ ಕಣಗಾಲ್,Negative,Not_offensive
3819,Rock Siddu yaako gaandu soole magane naanu ninna thangina rape maadidna.. yelo mathannu ole mathanaadu.. nanagu baahi ide.. nanage gothilade thapagide.. Neenu mathado reethi badalisiko ...,Negative,Offensive_Targeted_Insult_Individual
1643,Dagar boobs ogo boddide,unknown,Offensive_Untargetede
5450,hudugi andre yak saytiro.........,Negative,Offensive_Untargetede
3727,Rakshit shetty Future superstar annoru Like madi,unknown,Not_offensive
1556,Chindi broiiii e munde maklige naman desha bakthi kammi sayor yelo saythare e bevrcgalige tiktok mukya anthe,Negative,Offensive_Targeted_Insult_Other
1709,Dislike madidavaru dagar rashimka fans,Negative,Offensive_Targeted_Insult_Group
4830,Thumba chenagi ede,Positive,Not_offensive
6332,ಜೈ ಹಿಂದ್,Positive,Not_offensive
5855,ಇಂತಹ ಮಹಾನ್ ವ್ಯಕ್ತಿಯ   ಸಂದರ್ಶನ ಮಾಡಿದ ನಿಮ್ಮ ಚಾನೆಲ್ಗೆ ತುಂಬಾ ಧನ್ಯವಾದಗಳು,Positive,Not_offensive
1393,Bosdike nimmappa sattaga ninu mosale kanniruhaktiyo..I'll a shocky madtiyo no do na madarchod.,Negative,Offensive_Targeted_Insult_Individual
6319,ಜಾಸ್ತಿ ಕಾಯುಬೇಡಿ ಈ ವಿಡಿಯೋ ನೋಡಿ   ಹೆಸರಾಂತ ಹಿಂದಿ ಟಿವಿ ಚಾನೆಲ್ ಜಿ ನ್ಯೂಸ್ ನವರು ಸೆರೆ ಹಿಡಿದಂತಹ ನೈಜ ಘಟನೆ,Positive,Not_offensive
3844,Sahitya and sangita eradu super movie blockbuster,Mixed,Not_offensive
2158,Gurudesh pandey sir remake madobadlu swamek    madi sir,Negative,Not_offensive
7036,ಸಾಂಗ್ ಚಿಂದಿ ಗುರು,Negative,Not_offensive
2579,Instagram ali share madi avlna tag madi e math helu bro,Mixed,Not_offensive
5622,super guru idhu actually chennagirodhu,Positive,Not_offensive
7246,ಹೌದೋ ಹುಲಿಯಾ.....ಹಾಡು ಸೂ..............ಪರ್..................,Positive,Not_offensive
5958,ಈ ಒಂದ್ ಸಾಂಗ್ ಸಾಕು ಬುಡು ಗರು ನೀನ್ ಗೆದ್ದೆ jai @rakshith shetty,Positive,Not_offensive
641,@TROLL MONSTER_KANNADA @vishal shetty @vinodkalmani @Italy Davi lowdan Lovezz Candy  ಅಂತಾ blind followersಗೆ ಈ ರೀತಿ ಅರ್ಥ ಮಾಡಿಸಬೇಕಾ???? ನೆನ್ನೆ ಮೊನ್ನೆ ಲಬೊ ಲಬೋ ಅಂತ ಬಾಯಿ ಬಡ್ಕೋತಿದ್ದ..... ಇವತ್ತು ಅದೆಲ್ಲಿ ಹೋದನೊ???? mobile no. ಹಾಕೋಕು ಹೆದರಿಕೆ ಬೋಳಿಮಗನಿಗೆ..... ಸುಮ್ನೆ ಬಾಯಿ ಹರಿದುಕೊಂಡು ಅಮ್ಮನ್ ಅಕ್ಕನ್ ಅನ್ನೋದಲ್ಲ..... ನೀವೂ ಗಂಡಸರೆ ಆಗಿದ್ರೆ ನಿಮ್ ನಂಬರ್ ಹಾಕ್ರೋ ಬೇವರ್ಸಿ ಬೋಳಿಕೆಗಳ..... ಥೂ ನಿಮ್ ಜನ್ಮಕಿಷ್ಟು ಬೆಂಕಿ ಹಾಕ.....,Negative,Offensive_Targeted_Insult_Group
7206,ಹಾಡು ಯಾರಿಗೆ ಇಷ್ಟ ಆಯ್ತು Handsup ‍,Positive,Not_offensive
1531,Chennagi ugidira sara,Negative,Not_offensive
3777,Rashmikage vs takkange ede e song super guru,Negative,Not_offensive
5242,Yaryaru matte nodtiddira like madi,Positive,Not_offensive
891,@syed Noor Noori sdi ಧನ್ಯವಾದಗಳು,Positive,Not_offensive
2125,Guru ee desha uddhara agalla bedu bhai indian youth waste bedu,Negative,Offensive_Targeted_Insult_Other
4786,Thank you Akhillanna,Positive,Not_offensive
5962,ಈ ಕರಾವಳಿ ಶೆಟ್ರು films ಯಾಕೆ ಇಷ್ಟೊಂದು dull and bore ಹೊಡಿಸುತ್ತೋ ಗೊತಾಗ್ತಿಲ್ಲ. ಆ ಕಿರಿಕ್ ಪಾರ್ಟಿ,Negative,Offensive_Targeted_Insult_Group
6998,ಸಖತ್ ಟ್ರೋಲ್ ಬ್ರದರ್ nಬ್ರೊ ಈ ಗೇಮ್ ನೇಮ್ ಹೇಳಿ,Positive,Not_offensive
5401,complete kwatley guru ninu..,Positive,Not_offensive
5442,hello amar prasad tumbha chenda itthu nimma ee pryatna saakashut vishyagalannu  munde ittiri idu namege gothe iralilla. china nijakku entha samartha desha deshpreemigale tumbiruvantha desha moodalu nammale ee daridara raajakihavannu oddu military adalita barabeku ega itndu kobbiruva raajakaarnigalaga asthi pasthigalannu ondu rupeenu beedade kitthukondu avarannu beedhi bhikharimaadidare namma desha sirivanthavaaguvudaralli no doubt,Positive,Offensive_Targeted_Insult_Group
6099,ಒಂದೊಂದು ಮಾತು ಚಪ್ಪಲಿ  ಹೊಡೆದಂತೆ ಇತ್ತು ಗುರು ಒಬ್ಬೊಬ್ರು ನೋಡಬೇಕಿತ್ತು ಸರ್ ಚೀನಾಗೆ ಹುಟ್ಟಿರುವ ತರಹ ಆಡುತ್ತಾರೆ ನಮ್ಮ ದೇಶದಲ್ಲಿ ಎಷ್ಟು ಜನ ಸೈನಿಕರು  ಸಾಯ್ತಾರೆ ಅವರಿಗೆ ಏನಾಗಬೇಕು ಟಿಕ್ ಟಾಕ್ ಲೈಕ್ ಬಂದ್ರೆ ಸಾಕು ನನ್ನ ಕಮೆಂಟ್ ಅಲ್ಲಿ ಏನಾದರೂ ತಪ್ಪಿದ್ದರೆ ಕ್ಷಮಿಸಿ ಜೈ ಹಿಂದ್ ಜೈ ಕರ್ನಾಟಕ ಮಾತೆ,Mixed,Not_offensive
868,@sharath sharu nin ammun tullge nan tunne sigaka berke sule magne,Negative,Offensive_Targeted_Insult_Individual
916,@Ŕävîñđŕå_02_GøWđřú noh Ravindra Lowdre.... naanu space nalli idini.... hudukikond baroke rocket beku.... nin yogyate ge adella illa bidu🤣,Negative,Offensive_Targeted_Insult_Individual
1718,Dislike madirovur rasmika panzgalu,Negative,Offensive_Targeted_Insult_Group
4877,Tiktok Ban Madi olle kelsa Madi edare,Positive,Not_offensive
686,@Troll Stupid Fans war ge antha bandre nimmakkan minda naanu samskrutha innu start madilla ninge beku andre helu start madona,Negative,Offensive_Targeted_Insult_Individual
2169,Ha sir..kanada movie nam janane  nodthaila,Negative,Offensive_Targeted_Insult_Other
5259,Yavd yavd movie ge hogi dud kharch madidvi...bejaragi hogad bittivi...dia movie mobile li nodid mele theater nali nodbeku anstide...,Negative,Offensive_Untargetede
6898,ರಕ್ಷಿತ್ ಶೆಟ್ಟಿ ನಮ್ಮ ಕನ್ನಡ  ಇಂಡಸ್ಟ್ರಿ ನ ಬೆಳವಣಿಗೆ ಮಾಡಲಿಕ್ಕೆ ಬಂದ ಇನ್ನೊಬ್ಬ ರಜಕುಮರ್ ಅಣ್ಣಾವ್ರು ಒಂದು ಲೈಕ್ ಮತ್ತೆ ಎಷ್ಟೊಂದು ಜನರು ಕನ್ನಡದಲ್ಲಿ ಕಾಮೆಂಟ್ ಮಾಡಿದವರಿಗೂ ಹ್ಯಾಂಡ್ಸಪ್ ಜೈ ಕರ್ನಾಟಕ ಮಾತೆ,Positive,Not_offensive
5220,Yappa huchhu hidustide.....asn.....awesom,Positive,Offensive_Targeted_Insult_Other
1968,Film re realise madi,Positive,Not_offensive
4387,Super guru neevu,Positive,Not_offensive
6208,ಕೆಲ ದಿನಗಳ ಹಿಂದೆ ಕನ್ನಡದ ನಟ ಒಳ್ಳೆಯ ಕನ್ನಡ ಸಿನಿಮಾಗಳನ್ನು ನೋಡಿ ಅಂತ ಸ್ವಲ್ಪ ಖಾರವಾಗಿ ಹೇಳಿದಾಗ ಎಲ್ಲಾರು ಕೆಟ್ಟದಾಗಿ ಅವರನ್ನು troll ಮಾಡಿದರು  ಹೇಳಿದವರು ಮಾತ್ರ ಕೆಟ್ಟವರಾದರು ಆಗ ನೀವು ಸುಮ್ಮನೆ ಇದ್ದಾರಿ ಈಗ ಅನುಭವಿಸಿ ಈ nಪರಿಸ್ಥಿತಿಗೆ ಕಾರಣ  ಕನ್ನಡ ಚಿತ್ರರಂಗದಲ್ಲಿ ಒಗ್ಗಟ್ಟು  ಇಲ್ಲ,Negative,Offensive_Untargetede
6031,ಎನ್ making ಗುರು,unknown,Not_offensive
7236,ಹೌದು ಹುಲಿಯ,unknown,Not_offensive
4803,Thappu ella nima kelavodu dailog druva sarja thara ede sprrrr,Positive,Not_offensive
4544,Super song anna....liked it,Positive,Not_offensive
3685,Pubgi kooda ban agbikittu,Mixed,Not_offensive
6133,ಕನ್ನಡ is super,Positive,Not_offensive
75,15 days inda bari dia movie status akthaedini bro awesome movie bro,Positive,Not_offensive
6499,ನಗು ಬರಲ್ಲ ಅಂತ ಹೇಳಿ ನಗುಸ್ತಿರಲ್ಲ ಬ್ರೊ,Positive,Not_offensive
5240,Yaru yar fans agiri parvagilla kannada industry belibekhu annoro like madi 🥳 hosa charithre barili namma industry 🥳🥁 HANDS    UP,Positive,Not_offensive
1192,Avane gay Rak'shit' shetty,Negative,Offensive_Targeted_Insult_Individual
4772,Telegram olag ella sigtirbekadre jana yak theotor ge hogtar heli.. Actully edu big mistek,Negative,Offensive_Targeted_Insult_Group
1497,Bro...nNeen este Roast madudru...China ne beku anthare ivrnella gun thagond shoot madbeku aagadru India dalli eetara Desha virodhi galu sattadru saythare... Nin video nodi actually innondsari tiktok alla mbl muttoku nin permission kelbeku... nInnond strong aagi video madu guru...,Negative,Offensive_Targeted_Insult_Other
976,Actually point point nu bidsi supper aagi helidiya supppppppppeeeerrrrrbbb,Positive,Not_offensive
5392,bro same video part 2 madu bro please plsssssssssssssssssssssssssssssssssssss swalpa bindu Gowda na akond roaste madu bro,Positive,Not_offensive
3771,Rashmika missed him!,unknown,Not_offensive
7124,ಸೂಪರ್ ಟ್ರೈಲರ್ ಅಲ್ ದಿ ಬೆಸ್ಟ್ ಫ್ರಮ್ ಡಿ ಬಾಸ್ ಫ್ಯಾನ್.  ಜೈ ಡಿ ಬಾಸ್,Positive,Not_offensive
2282,Hemme aagutte sir. Neevu nijakku great,Positive,Not_offensive
2278,Hello Hindi song,unknown,Not_offensive
3443,Nkn ಚಿಂದಿ,Negative,Not_offensive
6996,ಸಕ್ಕತ್ತಾಗಿದೆ ... ROCK KANNADA ROCK...,Positive,Not_offensive
6435,ತೊಗರಿ ತಿಪ್ಪ ಸೂಪರ,Positive,Not_offensive
7229,ಹೌದು ಅವನು ನನಗೆ ರಾತ್ರಿ  ಬೇಟಿಯಾಗಿದ್ದ ಕಣ್ಣು ಮುಚ್ಚಿ  ತೆಗೆಯೋದರೂಳಗೆ ಬೆಳಕಾಗಿತ್ತು,Mixed,Not_offensive
5667,tiktok madle beku andre  chines border bidona alle tiktok madi syali,Negative,Offensive_Targeted_Insult_Group
4477,Super rakshit shetti ajanish,Positive,Not_offensive
6701,ಪಕ್ಕಾ ಇದು ಚರಿತ್ರೆ ಸೃಷ್ಠಿ ಸೋ ಅವತಾರ,Positive,Not_offensive
5766,ಅದ್ಭುತ ಸರ್ ಜೇವನದಲ್ಲಿ ಎಂದು ಸೋಲುಬಾರದು great ನಿಜವಾಗಿಯೂ,Positive,Not_offensive
6995,ಸಕ್ಕತ್ತಾಗಿ ಉಗಿತಿರ ಅಣ್ಣ 🤮🤮🤮ದೊಡ್ಡ ಸ್ಟಾರ್ ಥರ ಅಡಿತವೇ.....  ಥು........,Negative,Offensive_Untargetede
4708,Supper  p boss... Yar unlike madidhare nodi.. urkondu saytor anta,Negative,Offensive_Targeted_Insult_Group
4202,Super  video  neja  bro  .....slutie  jaihind,Positive,Not_offensive
6328,ಜೈ ಡಿ ಬಾಸ್ ಫ್ಯಾನ್ ಪ್ಲೀಸ್ ಸಪೋಟ ಮಾಡಿ..,Positive,Not_offensive
6022,ಉಪೇಂದ್ರ avra Thara ide direction,Positive,Not_offensive
3737,Rakshith Sir fan like here,Positive,Not_offensive
1867,En helde guru,Positive,Not_offensive
6157,ಕನ್ನಡ ಸಿನಿಮಾ ರಂಗ ನಿಜಕ್ಕೂ ಮುಳುಗುತ್ತಿರುವ ದೋಣಿಯೇ ???nn,Negative,Offensive_Untargetede
1881,En super helidya bro innu eno beku,Positive,Not_offensive
1651,Daridra rajkaranadinda Kelsane sigtilla guru company factory yella muccho stitili idare,Negative,Not_offensive
1891,Enna e sulegalege troll madu guru,Negative,Offensive_Targeted_Insult_Group
2613,Ivrantu un install madalla sulemaklu. Avrna following madtiro nayigalige buddi barbeku modlu. Nam India dalliro inta nayigala kathe ne istu deshad bagge yenadru gottidre tane. Tiktok nalli bandu motivation helo ivlige deshad bagge keladre yenu gottiralla guru ivakke. Avar maneli bodig bittidare avalna navadru enmadokagatte,Negative,Offensive_Untargetede
2545,Idu idu.. (1.56)actually bekagiddu..osm music,Positive,Not_offensive
1983,Firstu neen beldu,Negative,Offensive_Untargetede
5497,lo thagari thippa suppr kano,Mixed,Not_offensive
54,100 days pakka annoru like madi,unknown,Not_offensive
5965,ಈ ಚಲನಚಿತ್ರವನ್ನು ನೋಡಿದ ನಂತರ,unknown,Not_offensive
3363,Nijwaglu idare antha nambake agta illaaa,Mixed,Not_offensive
6617,ನಿಜಕೂ ಈದು ಆಚರಿನೇ🤔🤔🤔🤔🤔🤔🤔🤔🤔🤔🤔🤔🤥🤥🤥🤓🤡🤡🤡🤠🤠🤠,Negative,Offensive_Untargetede
3377,Nim movie scene Evaga viral aagidhe anna,Mixed,Not_offensive
4319,Super bro yanke uninstall madbeku anno gandugale saryag helidira,Positive,Not_offensive
3186,Nammuralli bandidda nane One-up coffee bread kottu kalsde.....,unknown,Not_offensive
6103,ಒಬ್ಬ ನಟ  ಡ್ರೈವಿಂಗ್ ಮಾಡ್ತಿದಾರೆ ಇದು ನೋವಿನ ಸಂಗತಿ ಒಪ್ಪೀ ಕೊಳ್ಳೋಣ.  ಆದ್ರೆ ಒಬ್ಬ ಸಾಮಾನ್ಯ ಮನುಷ್ಯ ಡ್ರೈವಿಂಗ್ ಮಾಡ್ಕೊಂಡೆ ಜೀವ್ನ ಮಾಡ್ತಿರ್ಥನೆ ಅನ್ನೋದನ್ನ ಮರೀಬೇಡಿ ಸ್ನೇಹಿತರೆ,Positive,Not_offensive
6505,ನನಗೆ ಕಾಣುವ ಒಂದೇ ತಪ್ಪು...... publicity ಮಾಡದೇ ಇದ್ದದ್ದು. ....,Negative,Offensive_Untargetede
4691,Superb songnದೀಪಣ್ಣನ ಅಭಿಮಾನಗಳ ಕಡೆಯಿಂದ ರಕ್ಷಿತ ಶೆಟ್ಟಿಯವರಿಗೆ ಶುಭವಾಗಲಿ....,Positive,Not_offensive
1767,E film kgf level ig erbhodu annoru like maadi adunnu meersbhodu annoru comment maadi ...,Positive,Not_offensive
487,@Nandi Parthasarathi ಯಾಕೆ ಹುಡುಕೊಂಡು ಬಂದ್ರೆ ತುಲ್ಲು ಕೊಡ್ತೀಯಾ ಬೇವರ್ಸಿ,Negative,Offensive_Targeted_Insult_Individual
3114,Mysore maharajara bagge hemme inda helidralla tumba chennagittu.,Positive,Not_offensive
3851,Sakatag ede video brooo,Positive,Not_offensive
5077,WHO ARE RAKSHIT SHETTY FAN GIVE ME LIKE . RAKSHIT SHETTY SONG IS FULL OF FIRE .,Positive,Not_offensive
5340,YouTube subscriber at list 5lack kooda Ella yelli reach agutte T series nalli bittidre 10m agirodu avraddu tappu,Negative,Offensive_Untargetede
2320,Hindi kuthe aahe,Mixed,Not_offensive
6255,ಗುರು ನಿನ್ ಹೇಳು ಪ್ರಕಾರ ಯಾರು ಮಾವಿನ್ ಸುಪೋರ್ಟ್ ಮಾಡ್ಬಾರ್ದು,Mixed,Offensive_Targeted_Insult_Individual
1931,Every day i am listening,Positive,Not_offensive
5537,o my god wt a acting bro really my eyes are wet nice concept keep it up bro now a days alli avarage thumba bejar ago tara madatara jana naavu tilidu antavaru agi hag madidre hege heli naavu avara baavanegalige spandisibeku alva avaralli kuda thumba jana achive madidara tamil naadu alli oblu i.p.s agidale enu bala jana ne edara pls frds avarage naavu supportive agirbeku alva nice concept anna,Positive,Not_offensive
4755,TUNNE YASH BOLIMAGANE,Negative,Offensive_Targeted_Insult_Group
2303,Hidden detail in  trailer of Avane Srimanarayana....n,Mixed,Not_offensive
5215,Yan helidiya guru,Positive,Not_offensive
1630,D.boss fans kade doddadagi wel come madtivi sir,Positive,Not_offensive
3996,Sir nam deshadalli political sari erbeku jati beda elde balbeku avaga devolop agbhdu,Positive,Not_offensive
2351,Hindiyelli film release madbekittu bro,Positive,Not_offensive
6179,ಕನ್ನಡಿಗ ಕಲಾರಸಿಕ nAvane Srimannarayana Trailer-BGM n          Re-Createdn,unknown,Not_offensive
517,@Nikhil raj arya Nija kananna,Mixed,Not_offensive
4404,Super guru.........ji kannadiga,Positive,Not_offensive
6027,ಎಂಥ lines,unknown,Not_offensive
2730,Kannada movie songs  Kannada movie All No 1,Positive,Not_offensive
1839,Egu edare sir,Positive,Not_offensive
2578,Insta link ಅಕಿದ್ದೀನಿ ನೋಡಿ bro ಅಲ್ಲಿ ಬಂದು,Mixed,Not_offensive
1086,Anjali Devi  I hate anjali manjali gunjali,Negative,Offensive_Targeted_Insult_Individual
672,@Thilak Kumar  e ondu mathu    saku bro    Kannada   industry ge support,Positive,Not_offensive
218,@CHNADU Ganeshakar hlo ಹೇಳಪ್ಪ ಇದಿನಿ,Negative,Not_offensive
1104,Anna Saudi Arabia li release maadi,Positive,Not_offensive
461,@Nandi Parthasarathi ನಿಂದು ಬೀದಿ ನಾಯಿ ತುಲ್ಲು ಅನ್ಸುತ್ತೆ,Negative,Offensive_Targeted_Insult_Individual
76,18min agidde gottaglilla,Positive,Not_offensive
970,Abbbbaa super tik tok ban ayithu,Positive,Not_offensive
6714,ಪ್ರಚಾರ ಇಲ್ಲದ ಕಾರಣ ನಮಗೆ ಒಳ್ಳೆಯ ಚಿತ್ರ ನೋಡಲು ಅವಕಾಶ ಆಗಲಿಲ್ಲ.,Negative,Offensive_Untargetede
4046,Sir ನಿಮ್ಮ ಮಾತು 100 ಕ್ಕೆ ೧೦೦% ಸತ್ಯ..,Positive,Not_offensive
3483,OMG ಟಿಕ್ ಟಾಕ್ ನಿಂದ nಚೈನಾದ ಬೋ* ಮ* 7,Negative,Not_offensive
7059,ಸಾಹಿತ್ಯ ಓದಿ ಹಾಡು ಕೇಳಿ ಆನಂದಿಸಿ.,Positive,Not_offensive
5792,ಅಭಿನಯಚಕ್ರವರ್ತಿ ಕಿಚ್ಚಾ ಸುದೀಪಣ್ಣ ಫ್ಯಾನ್ಸ್  ಸಪೋಟ್ ಇನ್ ಅವನೇ ಶ್ರೀ ಮನ್ನಾರಾಯಣ ಮೂವಿ,Positive,Not_offensive
6642,ನಿಮಗೆ ಒಲೆಯದು ಆಗಲಿ ಸಾರ್,Positive,Not_offensive
6824,ಮೆರೆಯಲಿ ಗಗನದಲಿ ನಿಮ್ಮ ಲಾಂಛನ,Positive,Not_offensive
5191,Yaav movie flop andri?,Mixed,Offensive_Targeted_Insult_Individual
3817,Rite.... Bt avara personal adu.. problems en aitu anta namge gotilla ...yake hudgi mele hig coments mododu brother??? Nam sis ge idu agidre?? Nav en madtidvi??  Aur problems avaru solve modkonda aitu naaav sumne ivele overthinking madta idivi ...,Negative,Not_offensive
577,@Rohith K le nin dagar bandli agtavne modlu kudlu olskoloke yelu ella nin avnu musodilla🤣🤣,Negative,Offensive_Targeted_Insult_Individual
5759,ಅದ್ಬುತ nಅತ್ಯದ್ಭುತ nಇದ್ ಫಿಲಂ ಅಂದ್ರೇ nಬಟ್ ನಮ್ಮವ್ರು ಗೆಲ್ಲಿಸಲ್ಲಾ,Positive,Not_offensive
1399,Boss nivu ultimate,Positive,Not_offensive
6210,ಕೆಲವರು ಡಿಬಾಸ್ ಬಾಸ್ ಅಂತಾರೆnಕೆಲವರು ಯಶ್ ಬಾಸ್ ಅಂತಾರೆnಕೆಲವರು ಕಿಚ್ಚ ಬಾಸ್ ಅಂತಾರೆnಕೆಲವರು ಪುನೀತ್ ಬಾಸ್ ಅಂತಾರೆnಇನ್ನೂ ಕೆಲವರು ಶಿವಣ್ಣ ಬಾಸ್ ಅಂತಾರೆnಆದರೆ ಅವರೆಲ್ಲರೂ ಅವನಿಗಾಗಿ ಕಾಯ್ತಾಇದಾರೆnಯಾರ್ ಅವನು  nಅವನೇ ಶ್ರೀಮನ್ನಾರಾಯಣ,Negative,Not_offensive
1233,Awsome movie must match movie,Positive,Not_offensive
3429,Nivu like goskara tiktok ge hogi idannella collect maadkondidira thane.niv  e video maadide full thappu .bcz nivu publisity goskare insta dalli follow maadi antha ella maathadthidira.matte avaru yella helidu thappu annodadre niv thumba bad words use maadidu thappe.,Negative,Not_offensive
3635,Pop corn monkey tiger kuda super idr,Positive,Not_offensive
5915,ಇದು ಚರಿತ್ರೆ ಸ್ರೃಷ್ಟಿಸೋ ಹಾಡು super super super,Positive,Not_offensive
3408,Nin voice super anna continue instalgram rost rost,Positive,Not_offensive
6215,ಕೇಳಿ ಕಾದಿರುವ ಬಾಂಧವರೇnnಭುವಿಯಲ್ಲಿ ಅವನ ಅರಿತವರೆnnಯಾರಿಲ್ಲ ಬಿಡಿ,Negative,Not_offensive
65,100% nija sir. Appaji tarah yaaru barolla.. ulidre kelavu snetaru bartaare.. Devru saha barolla..,Positive,Not_offensive
4030,Sir really talent  andre nimde nimmantavaru beku nam deshakke,Positive,Not_offensive
5668,time kelidru kelbeku ansutte e song next level song,Positive,Not_offensive
4360,Super duper..Film    Bust of luck... Prajval Devaraja..... Darling..   Days..,Positive,Not_offensive
441,@Nandi Parthasarathi ನಂದಿನಿ ಅವ್ರೆ ನಿಮ್ಮ ಹಾಲು ತುಂಬಾ ಕಾಸ್ಟ್ಲಿ ಅಂತೇ ಹೌದ,Negative,Offensive_Targeted_Insult_Individual
6740,ಬಡ್ಡಿ ಮಗಂದು ಯಾವತ್ ಬಾರುತೋ 27ನೇ ತಾರೀಖು,Negative,Offensive_Untargetede
18,#win 12 ನಿಮ್ಮ ಕನ್ನಡ ಪ್ರೇಮಕ್ಕೆ ಧನ್ಯವಾದ,Positive,Not_offensive
908,@vyv v even Producer for KP,unknown,Not_offensive
1628,D'Boss fan kade inda full support bro....,Positive,Not_offensive
4869,Tik tok uninstall madde irovrna china ge odsbeku bro,Negative,Offensive_Targeted_Insult_Group
3828,S sir niv helid not ja,Positive,Not_offensive
2765,Karavali karavali... Itte boda marre?? Film super hit aagbeku. Bere statesnavru nammatha nodbeku aste...,Positive,Not_offensive
3568,Pakk film sound madee  madutte annoruu like madii..,unknown,Not_offensive
1981,First time kannada movie film video song full bittirodu,Positive,Not_offensive
6219,ಕೇಳಿ ನೆರೆದಿರುವ ಬಾಂಧವರೆnಭುವಿಯಲ್ಲಿ ಇವನ ಅರಿತವರೆ ಯಾರಿಲ್ಲ ಬಿಡಿnಮುನ್ನುಡಿ ಇದ್ದರದೊಂದು ದಂತಕಥೆ..nಇದು ಚರಿತ್ರೆ ಸೃಷ್ಟಿಸೋ ಅವತಾರ...nnಮೈನವಿರೇಳಿಸೋ ಸಾಲುಗಳು,Positive,Not_offensive
5942,ಇನ್ನೊಂದು ಚರಿತ್ರೆ ಸೃಷ್ಟಿ ಸೋ ಸರ್ದಾರ,Positive,Offensive_Targeted_Insult_Group
3094,Music ನಿಂದ ಇ ಸಿನೆಮಾ 100 ದಿನ teater    ನಲ್ಲಿ ಇರತ್ತೆ,Positive,Not_offensive
1432,Bro hagandr kgf asn 5 language alli bidugade agute avaga bere industri avaru hage andre yenagutte,Mixed,Not_offensive
4297,Super bro huge video madu Anna,Positive,Not_offensive
1347,Bharatadalli Experience kelidre en madodu? Nav hosa kelsa madoke ready idivi,Negative,Not_offensive
4127,Spuerrrrrrrrr  songs,Positive,Not_offensive
4358,Super duper song,Positive,Not_offensive
4341,Super creative kannadiga,Positive,Not_offensive
5357,abba en song Superrr,Positive,Not_offensive
4932,Trailer ultimate ...  ಸಿನಿಮಾನೂ ಚೆನ್ನಾಗಿರಬಹುದು ಜಂಟಲ್ ಮ್ಯಾನ್ ಚಿತ್ರತಂಡಕ್ಕೆ ಒಳ್ಳೆಯದಾಗಲಿ... #ಪ್ರಜ್ವಲ್ ದೇವರಾಜ್.  Look super 🤩🤩,Positive,Not_offensive
2856,Likes goskara yaakro prathi video nallu d boss fans,Negative,Offensive_Untargetede
3126,Naanu nodde bro adu Chennai Alli full housefull,Positive,Not_offensive
6173,ಕನ್ನಡದಲ್ಲಿ ಹೊಸ ಪ್ರಯತ್ನಕ್ಕೆ ಒಳ್ಳೆದಾಗಲಿ,Positive,Not_offensive
3356,Nijvaaglu film na teaternalli nodade iroke sry. Innondu sari release madi,Positive,Not_offensive
993,Adu support irodarinda,unknown,Not_offensive
442,@Nandi Parthasarathi ನಂದಿನಿ ನಂದಿನಿ ನಿನ್ ಕೊಜ್ಜೆ,Negative,Offensive_Targeted_Insult_Individual
1925,Ethu guru Song Endare,Positive,Not_offensive
2022,Gaali maathina bajaaru suddi saarise sumaaru...,Negative,Not_offensive
3794,Re relice agbeku,Positive,Not_offensive
4100,Song super step ennu super,Positive,Not_offensive
1275,Barbeaku hogbeku aste  nav ತು೦ಬಾ ಹೀರೋ s ನೋಡಿ sakhgidhe ok good luck,Positive,Not_offensive
6385,ತಿಪ್ಪನ ಸ್ಟೋರಿ ಚಂದವಾಗಿದೆ,Positive,Not_offensive
965,Aata barutta? 27 kke  show madtini,unknown,Not_offensive
7074,ಸುದೀಪ್ ಅಣ್ಣನ ಅಭಿಮಾನಿಗಳಿಂದ ಕಡೆಯಿಂದ ಅವನೆ ಶ್ರೀಮನ್ ನಾರಾಯಣ ಚಿತ್ರ ಶತದಿನೋತ್ಸವ ಆಚರಿಸಲೆಂದು ಶುಭಕೊರುತ್ತೆವೆ,Positive,Not_offensive
6634,ನಿಜವಾದ ಹೀರೋ ನೀವು sir ಸ್ವಾಭಿಮಾನದ ಗುರು ನೀವು,Positive,Not_offensive
3968,Sir Nimma Swabhimana innu jasthi agli hage Devru nimge innu jasthi Shakthi kodli antha devaranna nanu kelikolluthene,Positive,Not_offensive
2228,Hands up ಇದು ವನವರತ,Positive,Not_offensive
6159,ಕನ್ನಡ ಸಿನಿಮಾ ಸೂಪರ್,Positive,Not_offensive
1138,Anna super talent  anna nimdu ide tara videos  madtabiri,Positive,Not_offensive
5647,super ತೊಗರಿ ತಿಪ್ಪ,Positive,Not_offensive
1836,Eetharau gandu questions yake keltairudo,Negative,Offensive_Targeted_Insult_Individual
6724,ಪ್ರಜ್ವಲ್ ದೇವರಾಜ್ ಈ ಸಿನಿಮಾ ನಿನ್ನ ಜೀವನದ ಅತ್ಯದ್ಭುತ ಚಿತ್ರ ಗಳಲ್ಲಿ ಒಂದು ಆಗುತ್ತೆ ಮುಂದೆ ಒಳ್ಳೆ ಕಥೆ ಗಳೂ ಮಾಡು,Positive,Not_offensive
1182,Astu sala kelidru kelbeku ansute bro super song,Negative,Not_offensive
