,comment,sent,off
5533,ningappa hutagannavar the best way is 4uíykhfjklbgkkñ,unknown,Offensive_Untargetede
4490,Super sang guru,Positive,Not_offensive
6216,ಕೇಳಿ ಕಾದಿರುವ ಬಾಂಧವರೇnಭುವಿಯಲ್ಲಿ ಅವನ ಅರಿತವರೆnಯಾರಿಲ್ಲ ಬಿಡಿ,Positive,Offensive_Targeted_Insult_Individual
3196,Nan uninstall madhe,Positive,Not_offensive
6064,ಎಷ್ಟು ದಿನ ಆಯಿತು ಕೇಳಿ ಓ ತುಂಬಾ ಖುಷಿ ಆಯಿತು,Positive,Not_offensive
2386,Howdu movie Adbhuta..... tumba chennagide..... but ending swalpa disturbing ansatte..... adi and diya ondagiddidre innu chennagirtittu..... Elru tumba chennag act madidare,Negative,Offensive_Targeted_Insult_Group
5898,ಇದು ಚರಿತ್ರೆ ಸೃಷ್ಟಿಸೋ ಅವತಾರ....,Positive,Not_offensive
209,@BAD BOY yappa Modlu Arta ago Tara type maadu,Negative,Offensive_Untargetede
4011,Sir nimma thumbnail sari illanNaanu ee film nodoke try madtiddini aadre bengaluralli ella kade 10,Mixed,Offensive_Targeted_Insult_Individual
2872,Loo Nim Makha muccha e Video gu Dislike yenro nim Hendti Munde Haga avr character Nodi kaliro life Andre yenu antha thu nanmakla,Negative,Offensive_Targeted_Insult_Other
718,@Venu ahgbowdu.,unknown,Not_offensive
92,2020 Blockbuster hit movie. Jai Karnataka,Positive,Not_offensive
4392,Super guru ninu love you,Positive,Not_offensive
3541,Only d boss ok jai Kannada all movies hmmm kotigobba bittu hehehe,Negative,Offensive_Targeted_Insult_Group
4304,Super bro naanu Tik Tok maadtidde aadre adenu nam desha kintluu hechenalla namge nam desh beku adke yella chinaa apps na in install maadidini,Positive,Not_offensive
4269,Super agide song maatra Haaands Up  n940 dislikes and still counting,Positive,Not_offensive
193,@Ambrish Mallad luccha fans nimma luccha suderpdu movie nodo Ella flop agtive side actor get fit baavali age eddane balegaara correctagi tindu barlike hell baavali🤣🤣,Negative,Offensive_Targeted_Insult_Other
3070,Movie yavaga boss,Mixed,Not_offensive
6244,ಗುರು ಅವರಿಗೆ ತಾಕತ್ತಿದ್ದರೆ ಯೂಟ್ಯೂಬ್ ಅರಸ್ ಆಗೋಕೆ ಹೇಳು 10 15 20 ಸೆಕೆಂಡ್ ಮಾಡೋ ಟಿಕ್ ಟಾಕ್ ಸಡೆಗಲಿಗೆ ಯೂಟ್ಯೂಬಲ್ಲಿ ಎಂಟು ಹತ್ತು ಇಪ್ಪತ್ತು ನಿಮಿಷ ವಿಡಿಯೋ ಮಾಡೋಕೆ ತಾಕತ್ತಿದೆಯಾ ಕೇಳು nnLove u ರೋಸ್ಟ್ team ಅಂಡ್ ಟ್ರೋಲ್ team,Positive,Offensive_Targeted_Insult_Group
4005,Sir nim account num kodi sir,Positive,Not_offensive
6004,ಈ ಹಾಡು ಚರಿತ್ರೆ ಸೃಷ್ಟಿಸುತ್ತೆ ಅನ್ನೋರು ಲೈಕ್ ಮಾಡಿ,Positive,Not_offensive
787,@king k ....ಎಲ್ಲಾ ರಾಜಕಾರಣಿಗಳು ಕಳ್ಳರೆ.... ಇದ್ದುದರಲ್ಲಿ ಬಿಜೆಪಿ ಯವರು ಕಡಿಮೆ ಕಳ್ಳರು....,Negative,Offensive_Targeted_Insult_Group
5431,ha nam manegu bandiida ...,Negative,Offensive_Untargetede
7154,ಸೂಪರ್ ಸಾಂಗ್........ ತುಂಬಾ ಇಷ್ಟ ಆಯ್ತು.....  love you rakshith bhai,Positive,Not_offensive
1198,Avane sriman narayana,unknown,Not_offensive
5931,ಇದೆಲ್ಲ ಪಬ್ಲಿಸಿಟಿ stunt ಇವ್ರ ಅಪ್ಪ ಮಾಡಿದ್ ದುಡ್ಡೇಲ್ಲ ಚಿಂದಿ ಉಡಾಯ್ಸಿ ಇವಾಗ ಕಳ್ಳ ಕಣ್ಣೀರ್ ಹಾಕ್ತಾವ್ನೆ,Negative,Not_offensive
3468,Number 1 movie,Positive,Not_offensive
5218,Yappa bhaya agutte,Mixed,Offensive_Untargetede
6340,ಟಿಕ್ ಟಾಕ್ ಬ್ಯಾನ್ ಮಾಡಿದ್ದೂ ಒಳ್ಳೆ ವಿಷಯ.  ಚೈನೀಸ್ ಅಪ್ ಗಳೆಲ್ಲ  ಬ್ಯಾನ್ ಮಾಡಿದ್ದೂ ತುಂಬಾ ತುಂಬಾ ಒಳ್ಳೆ ವಿಷಯ.,Positive,Not_offensive
6421,ತೂಗರಿ ತಿಪ್ಪ ಉತ್ತರ ಕರ್ನಾಟಕ ಜಾನಪದ ಹಾಸ್ಯಮಯವಾದ ಕಥೆ ತುಂಬಾ ಅದ್ಬುತವಾದದ್ದು,Positive,Not_offensive
977,Actually ಇದು ಇದು song  ಅಂದ್ರೆ...🤘🤘 ಏನಂತೀರಿ ಗೆಳಯರೆ.,Positive,Not_offensive
4471,Super pakka nodthini,Positive,Not_offensive
5852,ಇಂತಹ ಅದ್ಭುತ ಸಿನಿಮಾಯಳು ಮತ್ತು ಹಾಡುಗಳು ಕನ್ನಡದಲ್ಲಿ ಹೆಚ್ಚು ಹೆಚ್ಚು ಬರಲಿ  ಎಂದು ಎಲ್ಲರೂ ಹಾರೈಸೊಣ,Positive,Not_offensive
7010,ಸರ್ pls contact 9743436877,Positive,Not_offensive
833,@prithvi nayak ಚಪ್ಪರ್ ಬೋಳಿಮಕ್ಳ.. ಲುಚ್ಛನ್ ಫ್ಯಾನ್ಸ್ ಬುದ್ದಿ ಎಲ್ಲಿಗೆ ಹೋಗುತ್ತೆ ಎಲ್ಲಿ ಹೋದ್ರು ಬರಿ ಉರ್ಕೋಳ್ಳೋದೇ ಆಯ್ತು ನಿಮ್ಮ ಜನ್ಮಕ್ಕೆ.. ನಿಮ್ಮ ಲುಚನ್ಗೆ ಹೇಳ್ದ್ರೋ ಒಂದಾದ್ರು ಹಿಟ್ ಸೀರಿಯಲ್ ಕೊಡು ಅಂತಾ ಪೈಲ್ವಾನ್ ಸೀರಿಯಲ್ ಆಲ್ಸೋ ಫ್ಲಾಪ್,Negative,Offensive_Targeted_Insult_Group
3859,Sakkath song guru,Positive,Not_offensive
5510,movie is song Osam,Positive,Not_offensive
3385,Nimge Nijavagalu netiyagiddra,Positive,Not_offensive
7220,ಹೇಡಿ ಅಶ್ವತ್ಥಾಮ ಚಕ್ರವ್ಯೂಹದಲ್ಲಿ ಅಭಿಮನ್ಯುವನ್ನು ಎದುರಿಸಲಾಗದೆ ಪ್ರಾರಂಭದಲ್ಲೇ ಜೀವ ಉಳಿಸಿಕೊಳ್ಳುವ ಸಲುವಾಗಿ ಪಲಾಯನ ಮಾಡಿಬಿಟ್ಟ.... ಕೊನೆಯಲ್ಲಿ ಲೋಫರ್ ದುರ್ಯೋಧನನ ಮಾತು ಕೇಳಿ ಶಾಪಗ್ರಸ್ಥನಾಗಿ ಕಲಿಯುಗದಲ್ಲೇ ತಿರುಗಾಡುತ್ತಿದ್ದಾನೆ.... ಒಂದು ವೇಳೆ ನನ್ನ ಕೈಗೆನಾದರೂ ಸಿಕ್ಕರೆ ಅವನನ್ನು ಛೇಡಿಸದೆ ಬಿಡಲಾರೆನು,Negative,Offensive_Targeted_Insult_Individual
2218,Hands up kannadigaru🤚,Mixed,Not_offensive
5870,ಇದು ಕನ್ನಡ ಚಿತ್ರರಂಗದ ಚರಿತ್ರೆ ಸೃಟಿಸೂ ಅವತಾರ ಯಾರ್ ಅವನು .......... (ಅವನೇ ಶ್ರೀಮನಾರಾಯಣ) All The Best D B055 fan,Positive,Not_offensive
456,@Nandi Parthasarathi ನಿ ಮುಂಡೆ,unknown,Offensive_Targeted_Insult_Individual
410,@Nandi Parthasarathi illa kgfuck aythu,Negative,Offensive_Targeted_Insult_Group
6523,ನನ್ನ ಪ್ರಕಾರ ಈ ಫಿಲ್ಮ್ ಅನ್ನು re-release ಮಾಡಸಬೇಕು,Positive,Not_offensive
7014,ಸರ್ ಈ ತರಹ  ಸ್ಪೀಚ್ ಬೇಕು  ಪ್ರತಿ ನಿತ್ಯ  ಇಂತಹ  ವೀಡಿಯೋಸ್ ಬೇಕು  ಸರ್  ತುಂಬಾ ಧನ್ಯವಾದಗಳು,Positive,Not_offensive
1712,Dislike madiroeu pakka Hollywood heroine fans,Negative,Offensive_Targeted_Insult_Group
2062,God bless you Sir..nNimage olleyadagali ........,Positive,Not_offensive
4314,Super bro sari yagi heldde,Positive,Not_offensive
6122,ಕಂಕಣ ಸೂರ್ಯ ಗ್ರಹಣದ ಸಮಯದಲ್ಲಿ ಯಾರ್ ಯಾರ್ ನೋಡ್ತಿದ್ದಿರಾ...,Mixed,Not_offensive
7072,ಸುಂದರವಾದ ಹಾಸ್ಯ ಕಥೆ,Positive,Not_offensive
433,@Nandi Parthasarathi ಎಷ್ಟು ರೇಟು ಒಂದು ರಾತ್ರಿ ಬ ಸಾಕು,Negative,Offensive_Targeted_Insult_Individual
1635,DIA  u ಖುಷಿ,Positive,Not_offensive
2005,Full gichhh Madi nod anaa mast,Negative,Not_offensive
436,@Nandi Parthasarathi ಓಹೋ ನಂದಿನಿ ನಿಂದು ಮಿಲ್ಕ್ ಪಾರ್ಲರ್ ಬೇರೆ ಇದಿಯಾ,Negative,Offensive_Targeted_Insult_Individual
104,2nd song(Narayana) releasing tomorrow @11,unknown,Not_offensive
6404,ತುಂಬಾ ಚೆನ್ನಾಗಿ ವಿಚಾರ ಸಂಕಿರಣ ಮೂಡಿಸಿದ್ದಾರೆ  ಭಾರತ ಪ್ರಪಂಚದಲ್ಲಿ ಹಿಂದೆ ಉಳಿಯಲು ರಾಜಕೀಯ ವ್ಯವಸ್ಥೆ ಒಂದು ಪ್ರಬಲ ಕಾರಣ  ಪಕ್ಷ ಪಾತ ಸ್ವಜನ ಸೌಮ್ಯತೆ ಸಹ ಕಾರಣ ಎಂಬುದು  ತಿಳಿಸಿದ್ದಾರೆ nಕೌಶಲ್ಯ ಅಭಿವೃದ್ಧಿಗೆ ಹೇಚ್ಚಿನ ಮಹತ್ವ ಕೊಡಬೇಕಾಗಿದೇ   ಎಂಬುದು ಸಹ ಸತ್ಯ,Positive,Not_offensive
2503,Iddu benki,Positive,Not_offensive
2113,Guru Chinese mobile yen madodu,Negative,Not_offensive
232,@Creative Kannadiga tysm Anna....nivu comment madidakke...bt sry Anna...bcaz nan insta use madalla,Positive,Not_offensive
1042,All the best DBOSS darshan fans Kade endaa,Positive,Not_offensive
1773,E jana thav sathru kuda Tiktok na mathra uninstall madola ansuthe 🤦 kelsa ildhe showoff goskara tiktok madi china davrna belstisdre jothege tham mana maryade na halmadkotidare thu en jananappa ige roast madi bro tiktok madorgella.,Negative,Offensive_Targeted_Insult_Other
4027,Sir prajakeeya'kke support madi sir daily 30sec adru adra bagge heli start madi sir pls eno help agutte subscriber bahala jana ide,Positive,Not_offensive
1853,En Anna nim mathgalu Mika 🤣🤣🤣🤣instadalli sigtave bidi anna,Positive,Offensive_Targeted_Insult_Individual
2012,Full movie upload madri.. Ofter release pls,Positive,Not_offensive
6261,ಗುರುಗಳೇ  ನನ್ನ ಹೆಸರು ಗವೀಶ್  ಕೊಪ್ಪಳ.nನಾನು ಚಿಕ್ಕವನಿದ್ದಾಗ ತೊಗರಿ ತಿಪ್ಪನ ಕಥೆಯನ್ನು  ಕೇಳಿದ್ದೆ,Positive,Not_offensive
525,@P h Ahamad Bava ಅಣ್ಣ ಒಂದೆರಡು ಪದ ಬಿಟ್ಟು ಇನ್ನೂ ಉಳಿದ ಪದ ಅಚ್ಚ ಕನ್ನಡದಲ್ಲಿ ಇದೆ ಅಲ್ವಾ?,Mixed,Not_offensive
5967,ಈ ಚಿತ್ರ ಪ್ರಜ್ವಲ್ ಅವ್ರ ಕ್ಯರಿಯರ್ ಚೇಂಜ್ ಮಾಡೋ ಹಾಗೆ ಕಾಣ್ತಿದೆ ರಾಕಿ ಭಾಯ್ ಯಶ್ ಅಭಿಮಾನಿಗಳ ಕಡೆಯಿಂದ ಶುಭಾಶಯಗಳು🤗🤗🤗,Positive,Not_offensive
1193,Avane nam huduga.,Positive,Not_offensive
4821,Thriller Movie Andre ee Tara Irbeku,Positive,Not_offensive
2562,In ond trip nodbeku but but sinama chenge madbittru olle movi ge olle respans illa Nam karnatakadalli,Positive,Not_offensive
528,@Pavan Pavan nanu ivag nodidnalla adakke hakide 383k+like hagiddo  adakke comment madide tapputilkobedi okk naaaa,Negative,Not_offensive
6011,ಈಗ ನಿಜವಾದ ನಾಯಕ PRAJWAL  ಯಾರ್ಯಾರು ಕಾಯ್ತಾ ಇದ್ದೀರಾ ಒಂದು ಲೈಕ ಮಾಡಿ,Mixed,Not_offensive
2280,Helodannu kadime madu antialla desha uddarane,Negative,Offensive_Targeted_Insult_Individual
6320,ಜೀವನ ಬಹಳ ಚೆನ್ನಾಗಿ ಅರ್ಥ ಮಾಡಿಕೊಂಡಿದ್ದೀರ ಬಹಳ ಸರಳ ಜೀವಿ,Positive,Not_offensive
6321,ಜೀವನದಲ್ಲಿ ಶ್ರದ್ಧೆ ಮುಖ್ಯ.....  ಶ್ರದ್ಧೆ    ನಮ್ಮನ್ನು ಯಶಸ್ಸಿನ ಬೆನ್ನ ಹತ್ತುತ್ತಿಸುತ್ತದೆ.....,Positive,Not_offensive
4077,Song chindi chitranna guru,Positive,Not_offensive
1171,Ashwath avrne noddag aythu.,Positive,Not_offensive
3132,Nakkan benki guru,Positive,Not_offensive
264,@Entertainment Gaming ನಂಗೆ ಎಲ್ಲೋ ಕಾಣಿಸ್ತಾ ಇಲ್ವೇ ಇಲ್ಲ,Mixed,Offensive_Targeted_Insult_Individual
1787,E song super and handsome step super annowru like madi,Positive,Not_offensive
1286,Barri dabba movie ne unn maado du,Negative,Offensive_Targeted_Insult_Group
4451,Super movie yaa......,Mixed,Not_offensive
70,100M AAgle bek ..,Positive,Not_offensive
1527,Charitre srustiso avatara.....,Positive,Not_offensive
2735,Kannada ne best adrallu kannada songs adre hen andkondodira,Positive,Not_offensive
3107,My favorite song in 2019 is Taaja samachara   ಸಾಹಿತ್ಯ ಪ್ರಿಯರೇ ಒಮ್ಮೆ ಈ ಹಾಡು ಕೇಳಿದ್ರೆ ಕೇಳ್ತಾನೆ ಇರ್ಬೇಕು ಅನ್ಸುತ್ತೆ....  Everybody watch this,Positive,Not_offensive
7171,ಸೂಪರ್‌  ಸಾಂಗ್,Positive,Not_offensive
2181,Hahahaha  LoL nIdiot beggar get lost.,Negative,Offensive_Targeted_Insult_Other
5292,Yen super song guru..20 times kelde innu kelbeku anstide..BGM super,Positive,Not_offensive
3725,Rakshit setty avru ondu D boss ge script barudre eng erutte d boss fans,Positive,Not_offensive
420,@Nandi Parthasarathi nanna shanta samana Bollywood Hollywood sulemagne modlu ninna ಮಾತೃಭಾಷೆ ಬೆಳಸು adu yare hero aagli,Negative,Offensive_Targeted_Insult_Individual
3422,Nivella aa Udyonmukhi Rajakarani kadeyavara,Mixed,Offensive_Targeted_Insult_Group
5970,ಈ ಚಿತ್ರದಲ್ಲಿ ಯಾವ್ ರೇಂಜ್ ಗೆ ಗ್ರಾಫಿಕ್ಸ್ ಮಾಡಿದ್ದಾರೆ ಅಂತ ಮತ್ತೊಬ್ಬ vfx ಆರ್ಟಿಸ್ಟ್ ಗೆ ಗೊತ್ತಾಗೋದು,Mixed,Not_offensive
2241,Handsup shoot madbeka dishkaew,unknown,Not_offensive
4417,Super jai kanadiga,Positive,Not_offensive
1740,Diya..... idond name alla,Negative,Offensive_Untargetede
6579,ನಾನು ಕೂಡ ಬಿಟ್ಟಿಯಾಗಿ ನೋಡಿದೇನಿ ನನಗೆ ಒಂತರಾ ಮನಸ್ಸಿಗೆ ನೋವು ಆಗ್ತಾ ಇದೆ ನಾನು ಸಿನಿಮಾ ಗೆದ್ದಿದೆ ಬಟ್ ದುಡ್ಡು ಬರಲಿಲ್ಲ ಸಿನಿಮಾಗೆ,Negative,Offensive_Untargetede
7139,ಸೂಪರ್ ಬ್ರೋ ನಿಜ,Positive,Not_offensive
2177,Haha. Nin movie nodilla. 🤣🤣🤣,Negative,Offensive_Targeted_Insult_Individual
5857,ಇಂಥ ಒಳ್ಳೆ ಸಾಂಗ್ ಅನ್ನು ಕೂಡ dislike ಮಾಡ್ತಾರಲ್ಲ ಆವರು ಮನುಷ್ಯ ಜನ್ಮಕ್ಕೆ ನಿಜವಾಗಿಯು ಸೇರಿಲ್ಲ ಅನ್ಸುತ್ತೆ ನಿಮ್ಮ ಕೈ ಅಲ್ಲಿ ಲೈಕ್ ಮಾಡುಕೆ ಆಗಲ್ಲಾ ಅಂದ್ರೆ ಸುಮಸುಮ್ನೆ ಇಂಥ ಸಾಂಗ್ ಗೆ dislike matra ಮಾಡಬೇಡಿ,Negative,Offensive_Targeted_Insult_Group
3162,Namm department nalli clark kaali adaaw yaradru candidates edry hyli n9901919091 WhatsApp msg maadriii,unknown,Not_offensive
6489,ಧನ್ಯವಾದಗಳು ಸ್ನೇಹಿತರೆ ನೀವು ಪುರಾಣದಲ್ಲಿ ಬರುವ  ಯಲ್ಲರಿಗೂ ಬಹುವಚನ ದಿಂದ ಮಾತಾಡ್ತಿರ ಧನ್ಯವಾದಗಳು ಸ್ನೇಹಿತರೆ,Positive,Not_offensive
4436,Super movie 200days paka super guru see once dis movie,Positive,Not_offensive
1722,Dislike ಮಾಡೋ ಮೂರ್ಖರ ಬುದ್ದಿಗೆ ಶ್ರದ್ಧಾಂಜಲಿ.,Negative,Offensive_Targeted_Insult_Group
4059,Slow poison song hit like if u agree,unknown,Not_offensive
6787,ಬ್ರೋ ಲೈಕ್ appa ಬ್ಯಾನ್ ಆಗಿಲ್ಲ ಯಾವಾಗ ಆಗುತ್ತೆ,Mixed,Not_offensive
391,@Nagaraja P neev nodideera antha kelthiyallappa neenu,Negative,Offensive_Targeted_Insult_Individual
3852,Sakath anna nim haadu,Positive,Not_offensive
5280,Yen bro nivu supper nim fan agbitte,Positive,Not_offensive
152,@*V C R* guru edunna modlu bale fansge helu avru start madidare nau end madthivi,Negative,Not_offensive
2298,Hi sir supnHasage  eddastu kalu chachu  nAnno gadae evattu nim nudigalu gottyatyu sirnUr grate sir,Positive,Not_offensive
3491,Odeya film yeng edhe nodudra,Mixed,Not_offensive
6273,ಚನ್ನಾಗಿದೇ ಇದು ತೋಗರಿ ತಿಪ್ಪನ ಕತೆ,Positive,Not_offensive
6207,ಕೆಟ್ಟ ಮೇಲೆ  ನೆ ಬುದ್ಧಿ ಬರೋದು ...,Negative,Not_offensive
5063,Vilan ಬಳಿ ಒಂದು coin urali barhttalla,Mixed,Not_offensive
5550,rana song guru my boss singging vijay prakash love  u sar,Positive,Not_offensive
2755,Kannadadalli mado badlu hindinalli madidre superrhit agodhu,Negative,Offensive_Untargetede
508,@Nature  You tube ಕನ್ನಡದಲ್ಲಿ ಹೇಳಬೇಕೆಂದರೆ - ನೀನು ಕೊಳವೆ .....🤣🤣,Positive,Offensive_Targeted_Insult_Individual
3384,Nimdu bari ide aagoythu telegu avaru copy maadudre tm movie nodthira Kannada davru own aagi maadudru kyathe thegithira,Negative,Offensive_Targeted_Insult_Other
6005,ಈ ಹಾಡು ತುಂಬಾ ಇಷ್ಟವಾಯ್ತು,Positive,Not_offensive
6059,ಎಲ್ಲಿಂದನೋ ಕದ್ದಿರೋ ಹಾಗಿದೆ...🤔🤔,Negative,Not_offensive
4142,Still no 1 trending,Positive,Not_offensive
1319,Best madali olle  belavanige next level sandalwood,Positive,Not_offensive
1896,Eno ontara chnnagide annoru like madi🤔🤔🤔🤔🤔🤔🤔🤔🤔,Positive,Not_offensive
33,. .nanu 10 bari nodidene. nSuper.,Positive,Not_offensive
5746,ಅಣ್ಣನ ಮೂವಿ ತಿಕ್ಲ ಪೊರ್ಕಿ ಹುಚ್ಚ ವೆಂಕಟ್ ಆಡಿಯೋ ಲಾಂಚ್ ಮಾರ್ಸ್ ಅಲ್ಲಿನ ಅಥವಾ ನೆಪ್ಟ್ಯೂನ್ ನಲ್ಲಿನ,Positive,Not_offensive
912,@Ŕävîñđŕå_02_GøWđřú bro evnu venkatesh kulkarni avr comments ge reply madidane adanna odudre nin education EE flop,Negative,Not_offensive
325,@Kumara Kantirava avn heldange 1st time hange ansodhu..,Positive,Not_offensive
4143,Still trending No1...nAfter 4days....,Positive,Not_offensive
2830,Le Bindu naayi phone all radi togonda aaytha avarge adara laba sikatu aadare tik tok end dinaa avarage laba baratte enna mele yaava vastu Togo beda China vastu ninu Togo beda Naana antu tiragi nodalla Ni ale tuu,Negative,Offensive_Targeted_Insult_Individual
6037,ಎನ್ ಮಾಡೊಕಾಗುತ್ತೆ ಕೆಲವರು ನಮ್ಮೋರೆ   ತೆಲುಗು ಯಾವುದಾದರು ಸಾಂಗ್ ಟ್ರೈಲರ್ ಬಂದ್ರೆ ನಾಯಿ ಕಾಯೊ ಹಾಗೆ ಕಾಯ್ತಿರ್ತರೆ,Negative,Offensive_Targeted_Insult_Group
5845,ಆಶಿಕ ಸುಮ್ನೆ ನೀವೇ ಮದುವೆ ಆಗಿ ರಕ್ಷಿತ್ ಶೆಟ್ಟಿ ಅವರಿಗೆ .... ಜೋಡಿ ತುಂಬಾ ಚೆನ್ನಾಗಿರುತ್ತೆ....nnIn beauty you >>>>>>>>>>•••• Rashmika,Positive,Not_offensive
4637,Super ತೋಗರಿ ತೀಪ್ಪ,Positive,Not_offensive
3641,Prajakeeya barle beku,unknown,Not_offensive
1072,Amazing very nice prajwal life ge ondu hosa tiruvu koduvantaha cinima idu,Positive,Not_offensive
5512,movie was legendary. ninu itihasa baryoke bandirodu maga. kannada indutry history baredre eradu part irutte ondu rakshit baroku munche mattondu rakshit  bandadmele,Positive,Not_offensive
1421,Bro adru evaga bere language enda open madkond use madtaidaralla bro 🤦‍....thumba janridare nam jana e tara vishyadalli..haladavru🤦‍,Negative,Offensive_Targeted_Insult_Group
3680,Pruthvi avara acting anthu nanna avarisikondu bittide .nanna friend helidda thayi sentimentalli avara acting nodi ninu emotional agthiya nodu antha.adre nanu nanu aagalla andidde.adre aa scene nodbittu nanu ankonde. evarige national award kodbeku antha.,Positive,Not_offensive
1961,Film hit ahagokai e tharadha song irbaiku,Positive,Not_offensive
5120,What a music ... nWhat a lyric...nWhat a choreography.... nWhat a camera working......nTotally awesome ... nನಿಜಕ್ಕೂ ಇದು ಚರಿತ್ರೆ ಸೃಷ್ಟಿಸೋ ಅವತಾರ... nಅಜನೀಶ್ ಗುರುಗಳೇ ನಿಮಗೊಂದು ಸಲಾಂ...nರಕ್ಷಿತ್ ಶೆಟ್ರೆ ಒಳ್ಳೇದಾಗಲಿ ..nಮೂರು ವರ್ಷ ಪಟ್ಟ ಶ್ರಮ ಫಲಕೊಡುವಂತಾಗಲಿ..... All the best to you sir,Positive,Not_offensive
724,@Vinay Vn  nani gentle men??,unknown,Offensive_Targeted_Insult_Individual
2612,Ivnu soole maga pakka. Ivnu yash fan bandu hen kelsa madthavne nodro soole maga,Negative,Offensive_Targeted_Insult_Individual
7199,ಹಾಡು ಅತ್ಯದ್ಭತವಾಗಿ ಬಂದಿದೆ.. ಸಾಹಿತ್ಯ ತುಂಬಾ ಗಟ್ಟಿಯಾಗಿ ಇದೆ..,Positive,Not_offensive
6633,ನಿಜವಾದ ಸ್ಟಾರ್ ಅಂದ್ರೆ ನೀವು,Positive,Not_offensive
2535,Idu charitre srustiso avatara super sir,Positive,Not_offensive
6376,ಡೈರೆಕ್ಟರ್ ಗೆ  ಶರಣು,Positive,Not_offensive
2159,Guruve en creative sharanu love u kannadiga,Positive,Not_offensive
4109,Sooper pa Rakshit.  mukali haryanga talent paa nindu,Positive,Not_offensive
7148,ಸೂಪರ್ ಸಾಂಗ್ ಆಲ್ ದಿ ಬೆಸ್ಟ್ ರಕ್ಷಿತ್ ಶೆಟ್ಟಿ ಅಣ್ಣ,Positive,Not_offensive
3440,Nkn last dialogue lit,Negative,Not_offensive
1461,Bro nivu yava game adtaiyidara please comment,Mixed,Not_offensive
1974,Finally sonu gowda b day dhinane tiktok ban aythu,Positive,Offensive_Targeted_Insult_Individual
1046,All the best n      Yella  kannadigana paravagi nYella nataru nammavare,Positive,Not_offensive
4393,Super guru ninu..,Positive,Not_offensive
6018,ಉತ್ತರ ಕನ್ನಡದ ಹೆಮ್ಮೆ ಯ ನಟ್ and ನಮ್ಮ ಮೆಚ್ಚಿನ,Positive,Not_offensive
321,@Kirankumarkk Gowda muchtiya solpa?,Negative,Offensive_Targeted_Insult_Individual
1856,En dailouges guru nsuper gurunYou rocking gurunNin dailouges keludmele nim channel subscribe maadthiddeeni hinge continue maadu gurunInnondibru dingurbilligalu tiktok li buildup kodthidru avrnu ee videodalli topgersidre chanaagirthitthu,Positive,Not_offensive
7007,ಸರಿಯಾದ planning ಇರಬೇಕು. ನಮ್ಮ ರಾಜ್ಯದವರು  Business ನಲ್ಲಿ improve ಆಗ್ಬೇಕು.,Negative,Offensive_Targeted_Insult_Individual
5403,dandega takka maga sirnjhevana annodu hege anta thorise kottavru neu sirnyellanhayaka natarante sokeman nevalla sir,Mixed,Not_offensive
3432,Nivu thumba super,Positive,Not_offensive
7017,ಸರ್ ದಯವಿಟ್ಟು Red FM ನಲ್ಲಿ  ನಿಮ್ಮ ಹೆಸರು ಏನಿತ್ತು ಹೇಳಿ....ನಾನು Red FM ಯಾವತ್ತೂ ಕೇಳ್ತೀನಿ....n ನಾಗರಾಜ್ or ವರುಣ್ ???n    Pls Admin let me know....,Mixed,Not_offensive
3335,Nija helbekandre ee song yako sync aagtilla movie trailer type ge....,Negative,Offensive_Targeted_Insult_Other
302,@Kiccha Vitthal ನಿಮ್ಮ ಅವ್ವ ಗಲೀಜ್ ಅಂತೇ,Negative,Offensive_Targeted_Insult_Individual
6353,ಟ್ರೊಲ್ ಅನ್ನ ಸರಿಯಾಗಿ ಉಪಯೋಗಿಸ್ಥಹಿದಿರ. ಸೂಪರ್,Positive,Not_offensive
2876,Looks like Rango Movie,unknown,Offensive_Untargetede
6540,ನಮ್ಮ ಕನ್ನಡ ಚಿತ್ರರಂಗ ವಿಶ್ವ ಮಟ್ಟದಲ್ಲಿ ಬೆಳಗಲಿ ಅನ್ನೋ ಆಶಯ ಇದ್ದವರು ಲೈಕ್ ಮಾಡಿ.,Positive,Not_offensive
1468,Bro super aagi Ode kottidiya manga nann makkalige...,Negative,Offensive_Targeted_Insult_Group
5663,tandhege takka maga,Positive,Not_offensive
1228,Awesome song ..guru ವಿಜಯ್ sir ವಾಯ್ಸ್ superb,Positive,Not_offensive
7077,ಸುಪರ ತೊಗರಿ ತಿಪ್,Positive,Not_offensive
6473,ದಿಯಾ' ಸಿನಿಮಾ ನಾಯಕಿಗೆ 'ಅತ್ಯುತ್ತಮ ನಟಿ' ಅವಾರ್ಡ್ ಕೊಡಲಿಲ್ಲ ಅಂದ್ರೆ ಆಯ್ಕೆ ಸಮಿತಿಗೆ ಮೆಟ್ಟ್ ಮೆಟ್ಟಲ್ಲೇ ಹೊಡಿತೀವಿ.,Positive,Offensive_Targeted_Insult_Other
4043,Sir ಗೊತ್ತು sir ಈ video ಮಾಡಿ 1ವಾರ ಆಗಿದೆ ಅದುನ್ನ ಮೊದ್ಲು ನೋಡಿ sir,Positive,Not_offensive
788,@king k ...ಕರ್ನಾಟಕದಲ್ಲಿ ಅತ್ಯಂತ ಭ್ರಷ್ಟರು ಅಂದ್ರೆ ಜೆಡಿಸ್...ಮತ್ತು ಕಾಂಗ್ರೆಸ್.....ಇವರು ನಿಪುಣರು ...ಹಾಗಾಗಿ ಇವರು ತಪ್ಪಿಸಿಕೊಳ್ತಾರೆ......ಅರ್ಥ ಮಾಡಿಕೊಳ್ಳದೆ ಮಾತಾಡಬೇಡ.....,Negative,Offensive_Targeted_Insult_Group
6314,ಜಡ್ ಜಡ್ ನಕ್ಕ...,Mixed,Not_offensive
4184,Super  creative   guru,Positive,Not_offensive
1762,E bevrcgal maneli yavandru sathidre sari erodu,Negative,Offensive_Targeted_Insult_Other
217,@Bhimrao Naik nIde beda anta helodu,unknown,Not_offensive
2129,Guru eno heludri but sakkatag heludri super guru,Mixed,Not_offensive
1586,Correct aag helidri bro .. aa lfr ge tiktok ilde idre uta nidde baralla ansatte,Mixed,Not_offensive
7046,ಸಾರ್ ಇದೆ ತರಹದ ಜಾನಪದ ಚಟಾಕಿ ಹೆಸರುಗಳನ್ನು ತಿಳಿಸಿ ದಯವಿಟ್ಟು,Positive,Not_offensive
2788,Kera togondu odebeku nana magana,Negative,Offensive_Targeted_Insult_Individual
2372,Hope this movie will rule Indian cinema... ಅವನೇ ಶ್ರೀಮಾನ್ ನಾರಾಯಣ ಇನ್ನು ಹಲವು ಭಾಗಗಳಾಗಿ ಕನ್ನಡ ಚಿತ್ರರಂಗದಲ್ಲಿ ಅವತಾರಗಳನ್ನು ತಾಳುವುದರಲ್ಲಿ ಸಂಶಯವೇ ಇಲ್ಲ.,Positive,Not_offensive
666,@TROLL MONSTER_KANNADA ಯಾವ್ದೋ ಲೋಕಲ್ ಎಣ್ಣೆ ಕುಡಿದು,Mixed,Offensive_Targeted_Insult_Individual
3812,Rip Rashmika Mandanna In Advance,Negative,Not_offensive
6229,ಕ್ಲೈಮಾಕ್ಸ್ ಚೇಂಜ್ ಮಾಡಿ ರೀ ರಿಲೀಸ್ ಮಾಡಿ ಚಿತ್ರ ಸುಪರ್ ಹಿಟ್ ಆಗುತ್ತೆ ಗ್ಯಾರೆಂಟಿ,Positive,Not_offensive
6370,ಡಿ ಬಾಸ್ ದಶ೯ನ್ ಸರ್ ಅಭಿಮಾನಿಗಳ ಕಡೆಯಿಂದ ಆಲ್ ದಿ ಬೆಸ್ಟ್,Positive,Not_offensive
